ID,Author,Title,Year
SEAITB-4,John Searle,Is the Brain's Mind a Computer?,2006
MOOCH,John W. Moore,Computational Hullianism,1982
ERNAI,Marco Ernandes,Artificial Intelligence \& Games: Should Computational Psychology Be Revalued?,2005
BAROQP,Carlos Barth,"o ""Frame Problem"": A Sensibilidade Ao Contexto Como Um Desafio Para Teorias Representacionais da Mente",2019
COPNVW-2,Jack Copeland,Narrow Versus Wide Mechanism,2002
FREACA-3,Norman H. Freeman,A Computational Approach to Picture Production and Consumption is Needed Right Here,1989
SUNKII,Ron Sun,Knowledge Integration in Creative Problem Solving,manuscript
WALRKA-2,Charles Wallis,"Representation, Knowledge, and Structure in Computational Explanations in Cognitive Science",1995
SCHTCC,Matthias Scheutz,The Cognitive Computational Story,2000
MISCAT,Nenad Mi\v{s}v{c}evi\'c,Computationalism and the Kripke-Wittgenstein Paradox,1996
LACIIA,Roy Lachman,Imposed Intelligibility and Strong Claims Concerning Cognitive Systems,2004
FETPAT,James Fetzer,Peirce and the Philosophy of Artificial Intelligence,2004
VANFND,Frank van der Velde and Marc de Kamps,From Neural Dynamics to True Combinatorial Structures,2006
PICTFA,Gualtiero Piccinini,The Functional Account of Computing Mechanisms,2004
KOCTLI,Paul A. Koch and Gerry Leisman,The Local is Running on the Express Track: Localist Models Better Facilitate Understanding of Nervous System Function,2004
HELCCA-2,John Hell,"Computation, Cognition, and Representation",1980
HUDWIC,Patrick T. W. Hudson,What is Computational Neurolinguistics Anyway?,1979
SALDRP,Nancy Salay,"Dress Rehearsals, Previews, and Encores: A New Account of Mental Representation",2013
MICMCI,Donald Michie,?Mind-Like? Capabilities in Computers: A Note on Computer Induction,1982
TIMCC,Bert Timmermans and Axel Cleeremans,Computing Consciousness,manuscript
ANDAOA-6,James A. Anderson,Arithmetic on a Parallel Computer: Perception Versus Logic,2003
QUIIAM-3,Maria Eunice Quilici Gonzalez,Information and Mechanical Models of Intelligence: What Can We Learn From Cognitive Science?,2005
ITCCA,Masao It\=o and Yasushi Miyashita and Edmund T. Rolls,"Cognition, Computation, and Consciousness",1997
WEICIN,Walter B. Weimer,"Cognition is Not Computation, for the Reasons That Computers Don't Solve the Mind-Body Problems",1980
GUIPNM,Mazen Maurice Guirguis,"Peter Novak, Mental Symbols: A Defense of the Classical Theory of Mind Reviewed By",1998
PUTOCP,Hilary Putnam,On Computational Psychology,2009
LEIAUC,David Pierre Leibovitz,A Unified Cognitive Model of Visual Filling-in Based on an Emergic Network Architecture,2013
HAUOAO,"Helmut Hauser and Rudolf M. F\""{u}chslin and Rolf Pfeifer",Opinions and Outlooks on Morphological Computation,2014
SELAMO,"Evan Selinger and Timothy Engstr\""{o}m","A Moratorium on Cyborgs: Computation, Cognition, and Commerce",2008
FETTAC,James H. Fetzer,Thinking and Computing: Computers as Special Kinds of Signs,1997
PARRHS,Christopher Parisien and Paul Thagard,Robosemantics: How Stanley the Volkswagen Represents the World,2008
WILSCA-10,Rob Wilson and Steven W. Horst,"Symbols, Computation, and Intentionality: A Critique of the Computational Theory of Mind",1998
BOCBMA,Giuseppe Boccignone and Roberto Cordeschi,Bayesian Models and Simulations in Cognitive Science,2007
STAWH-2,Michael Richard Starks,?????????????*??????(2012?)??????????? (Will Hominoids or Androids Destroy the Earth? --A Review of How to Create a Mind by Ray Kurzweil (2012)) (2019????),2020
PITRFS,Karola Pitsch and Anna{-}Lisa Vollmer and Manuel Muhlig,Robot Feedback Shapes the Tutors Presentation: How a Robots Online Gaze Strategies Lead to Micro-Adaptation of the Humans Conduct,2013
WEIACR,Daniel A. Weiskopf,A Critical Review of Jerry A. Fodor's the Mind Doesn't Work That Way,2002
DAVCST-2,David Davenport,Computationalism: Still the Only Game in Town: A Reply to Swiatczak?s ?Conscious Representations: An Intractable Problem for the Computational Theory of Mind?,2012
STALHO,Michael Richard Starks,?Los Hominoides o Androides Destruir\'{a}n la Tierra? -- Una Revisi\'{o}n de ?C\'{o}mo Crear Una Mente? (How to Create a Mind) Por Ray Kurzweil (2012) (Revisi\'{o}n Revisada 2019),2019
AYDSFC,Murat Mustafa Aydede,"Syntax, Functionalism, Connectionism, and the Language of Thought",1993
STARDH-2,Michael Richard Starks,Rese\~{n}a de ?Hacer El Mundo Social? (?Making the Social World?) Por John Searle (2010) (Revisi\'{o}n Revisada 2019),2019
STARD-4,Michael Richard Starks,Rese\~{n}a de ' Los L\'{i}mites Exteriores de la Raz\'{o}n '(the Outer Limits of Reason) Por Noson Yanofsky 403P (2013) (Revision Revisada 2019),2019
YEETMA,Richard Yee,Turing Machines and Semantic Symbol Processing: Why Real Computers Don?T Mind Chinese Emperors,1993
STASQH,Michael Richard Starks,Ser\'a Que Hominoids Ou Androids Destroem a Terra? -- Uma Revis\~{a}o de Como Criar Uma Mente (How to Create a Mind) Por Ray Kurzweil (2012) (Revis\~{a}o Revisada 2019),2019
GRITPO-32,Nikitin Grigory and Danilova Marina,"The Phenomenon of ""Virtualization"" of the World in Modern Society",2018
STETVF,Joshua Stein,The View From Vector Space: An Account of Conceptual Geography,2014
CLATTC,Andy Clark,Twisted Tales: Causal Complexity and Cognitive Scientific Explanation,1998
SFEIFN,Nicolae Sfetcu,"Intelligence, From Natural Origins to Artificial Frontiers - Human Intelligence Vs. Artificial Intelligence",2024
PINLSA-2,Jean{-}Jacques Pinto,La Subjectivit\'e Artificielle : \'{E}bauche d'Un Projet de Recherche,manuscript
SANTAO-19,Desmond Sander,The Appearance of Consciousness in Machines,manuscript
RADOMI,Radicioni,On Mental Imagery in Lexical Processing: Computational Modeling of the Visual Load Associated to Concepts,2015
CORIPA-2,Roberto Cordeschi,Intentional Psychology and Computational Models,1988
CARTSD-4,Eros Moreira de Carvalho,Textos Selecionados de Filosofia da Cogni\c{c}~{a}o,2022
HARTCT-3,Stevan Harnad,The Causal Topography of Cognition,2012
CLATFC,Andy Clark,"The Frozen Cyborg: A Reply to Selinger and Engstr\""{o}m",2008
AKARRC,Akagi Mikio,Representation Re-Construed: Construal-Based Norms for Ascribing Natural Representations,manuscript
SCHORE,Prof Andreas Schierwagen,On Reverse Engineering in the Cognitive and Brain Sciences,2012
BURIAT-5,Marc Burock,Information and the Function of Neurons,2011
BROULA,Martin Andrew Brown,Understanding Language: A Luddite Approach,1993
MACCFS,Bruce J. MacLennan,Continuous Formal Systems: A Unifying Model in Language and Cognition,1995
STECTC,Lynn Andrea Stein,Challenging the Computational Metaphor: Implications for How We Think,1999
GOESOT-2,Vinod Goel,Sketches of Thought: A Study of the Role of Sketching in Design Problem-Solving and its Implications for the Computational Theory of Mind,1991
CHACHI-2,B. E. Charles Dyer,Computational Heuristic Intelligence- Cognition (Chi-Cog),2014
COWCBT,Stephen Cowley and Frederic Vall\'{e}e{-}Tourangeau,"Cognition Beyond the Brain: Computation, Interactivity and Human Artifice (2Nd Ed.)",2017
KINACA-2,Michael King,Analog Computationalism and Psychophysical Reduction,1998
SCHMAT-29,Susan Lynn Schneider,Meaning and the Computational Mind: The Relation Between Intentional and Computational States in a Scientific Psychology,2003
BIGOAC,Lucio Biggiero,Organizations as Cognitive Systems is Knowledge an Emergent Property of Information Networks?,unknown
GREWKO,Christopher D. Green and John Vervaeke,"What Kind of Explanation, If Any, is a Connectionist Net?",1996
CORPAI,Roberto Cordeschi,Philosophical Assumptions in Artificial Intelligence: A Tentative Criticism of a Criticism,1989
OSBTLS-2,George Osborne,The Logical Structure of the Cognitive Mechanisms Guiding Psychological Development,1995
DROMSC-2,Itiel E. Dror and Ailsa E. P\'{e}ron,"Matthias Scheutz, Computationalism New Directions",2004
CORPOT-6,Roberto Cordeschi,Philosophical Assumptions in Artificial Intelligence: A Tentative Criticism of a Criticism,1989
PICBRJ,Gualtiero Piccinini,"Book Review: John von Neumann, the Computer and the Brain, 2Nd Edition",2003
MLLMAB,"Vincent C. M\""{u}ller","Margaret A. Boden, Mind as Machine: A History of Cognitive Science , 2 Vols",2008
POLTIE,Thomas Polger,The Innocent Eye: Why Vision is Not a Cognitive Process by Nico Orlandi,2015
BULCAT-2,David J. Buller,Confirmation and the Computational Paradigm (Or: Why Do You Think They Call Itartificial Intelligence?),1993
RANBRO,Anand Rangarajan,"Book Review of ""the Embodied Mind: Cognitive Science and Human Experience""",manuscript
AMORJL,A. Morton,Review: John L. Pollock: Thinking About Acting: Logical Foundations for Rational Decision Making,2008
DIEEDS,Eric Dietrich,"Dynamic Systems and Paradise Regained, or How to Avoid Being a Calculator",1999
CUMCAC-5,Robert Cummins,Computation and Cognition,1988
BRICTL,Selmer Bringsjord,Clarifying the Logic of Anti-Computationalism: Reply to Hauser,2000
EGAMME,Frances Egan,"Milkowski, Marcin., Explaining the Computational Mind",2013
ARAROC,Andrew Arana,"Review of Computability: Turing, G\""{o}del, Church, and Beyond",2015
DIEIDS,Eric Dietrich,It Does So: Review of \emph{the Mind Doesn't Work That Way: The Scope and Limits of Computational Psychology},2001
PICJDT,Gualtiero Piccinini,"Jean-Pierre Dupuy, the Mechanization of Mind: On the Origins of Cognitive Science",2002
FLODHA,Juan Felipe Martinez Florez,Dietmar Heinke and Eirini Mavritsaki (Eds): Computational Modelling in Behavioural Neuroscience,2012
SILCCA,Stuart Silvers,"Cortical Conversations: A Review Essay on Cognition, Computation and Consciousness",1999
THAZWP,Paul Thagard,"Zenon W. Pylyshyn and William Demopoulos, Eds., Meaning and Cognitive Structure: Issues in the Computational Theory of Mind Reviewed By",1987
CHATPF,Nick Chater and Martin Pickering,Two Projects for Understanding the Mind: A Response to Morris and Richardson,1997
RIVLT,Bradley Rives,Lot 2: The Language of Thought Revisited,2009
HOLTMO-5,Maurice R. Holloway,"""The Modeling of Mind: Computers and Intelligence,"" Ed. Kenneth M. Sayre and Frederick J. Crosson",1965
PICSUC,G. Piccinini,Su Una Critica Dell'intelligenza Artificiale ?Forte?,1994
ASAHMR,Peter M. Asaro,"Hans Moravec, Robot. Mere Machine to Transcendent Mind, New York, Ny: Oxford University Press, Inc., 1999, Ix + 227 Pp., \$25.00 (Cloth), Isbn 0-19-511630-",2001
PRIBRC,Christopher G. Prince,Book Review: Computational Principles of Mobile Robotics,2004
MCDWTC,Richard McDonough,Why the Computational Theory of Mind Doesn't Compute,2001
WESCHO-2,Robert West,Cambridge Handbook of Computational Psychology,2009
CUMFIA,Robert Cummins,"Form, Interpretation, and the Uniqueness of Content: A Response to Morris",1991
KADIFM,John Kadvany,Indistinguishable From Magic: Computation is Cognitive Technology,2010
WARMS,Walter Warwick,Matthias Scheutz : Computationalism: New Directions,2003
GROPAN,Miles Groth,Psychology and Nihilism. A Genealogical Critique of the Computational Model of Mind,1995
CRODST-2,Mary Croarken,"Doron Swade, the Cogwheel Brain: Charles Babbage and the Quest to Build the First Computer. London: Little, Brown and Company, 2000. Pp. X+342. Isbn 0-316-64847-7. \pounds14.99",2004
ELIDAR,Chris Eliasmith,Discreteness and Relevance: A Reply to Roman Poznanski,2002
MAGBMH,Lorenzo Magnani,Beyond Mind: How Brains Make Up Artificial Cognitive Systems,2009
ENSTCL,Nathan Ensmenger,The Cultural Logic of Computation,2010
