ID,Author,Title,Year
PAROWM-3,Derek Parfit,On What Matters: Two-Volume Set,2011
MOOPE,George Edward Moore,Principia Ethica,1903
SIDTMO-2,Henry Sidgwick,The Methods of Ethics,1877
SIDTMO-7,Henry Sidgwick,The Methods of Ethics,1874
CRIRAT,Roger Crisp,Reasons and the Good,2006
BROFTO-4,C. D. Broad,Five Types of Ethical Theory,1930
Radek2014-LAZTPO-7,Katarzyna de Lazari{-}Radek and Peter Singer,The Point of View of the Universe: Sidgwick and Contemporary Ethics,2014
HURBET,Thomas Hurka,British Ethical Theorists From Sidgwick to Ewing,2014
SINSAR,Peter Singer,Sidgwick and Reflective Equilibrium,1974
SIDMOE,Henry Sidgwick,Methods of Ethics,1874
Radek2012-DELTOO-2,Katarzyna de Lazari{-}Radek and Peter Singer,The Objectivity of Ethics and the Unity of Practical Reason,2012
Lake2002-STREIR-3,Philip Stratton{-}Lake,Ethical Intuitionism: Re-Evaluations,2002
SCHSEA-3,Jerome B. Schneewind,Sidgwick's Ethics and Victorian Moral Philosophy,1977
HURMIT,Thomas Hurka,Moore in the Middle,2003
SIDOOT,Henry Sidgwick,Outlines of the History of Ethics for English Readers,1902
ANTIUR,Anthony Skelton,Ideal Utilitarianism: Rashdall and Moore,2011
SIDTPO-9,Henry Sidgwick,The Principles of Political Economy,2011
SKEHSM,Anthony Skelton,Henry Sidgwick?s Moral Epistemology,2010
Radek2010-DELSIC,Katarzyna de Lazari{-}Radek and Peter Singer,Secrecy in Consequentialism: A Defence of Esoteric Morality,2010
PHISE,David Phillips,Sidgwickian Ethics,2011
SIDTEO-4,Henry Sidgwick,"Lectures on the Ethics of T. H. Green, Mr. Herbert Spencer and J. Martineau",1871
SIDOOT-4,Henry Sidgwick,Outlines of the History of Ethics for English Readers,1896
ZHASAB,Yanxiang Zhang,Sidgwick and Bentham's ?Double Aspect? of Utilitarianism Revisited,2024
BRICSA-5,David O. Brink,Common Sense and First Principles in Sidgwick's \emph{Methods},1994
STUEIA,Nicholas Sturgeon,Ethical Intuitionism and Ethical Naturalism,2002
LILMOE,Hallvard Lillehammer,Methods of Ethics and the Descent of Man: Darwin and Sidgwick on Ethics and Evolution,2010
CRITCO-4,Roger Crisp,The Cosmos of Duty - Henry Sidgwick?s Methods of Ethics,2015
CANOMT,Giulia Cantamessi,Ordinary Moral Thought and Common-Sense Morality: Sidgwick?s Methods of Ethics,2024
CRISAT,Roger Crisp,Sidgwick and the Boundaries of Intuitionism,2002
SIDTEO,Henry Sidgwick,The Establishment of Ethical First Principles,1879
SIDTKC,H. Sidgwick,The Kantian Conception of Free Will,1888
SKEOSD,Anthony Skelton,On Sidgwick's Demise: A Reply to Professor Deigh,2010
ANTSPI,Anthony Skelton,Sidgwick's Philosophical Intuitions,2008
PHISTM-2,David Phillips,Sidgwick's the Methods of Ethics: A Guide,2022
SHASOP-2,Robert Shaver,Sidgwick on Pleasure,2016
BRISAT-8,David Brink,Sidgwick and the Rationale for Rational Egoism,1992
SKESOF,Anthony Skelton,Sidgwick on Free Will and Ethics,2023
SIDSFE,H. Sidgwick,Some Fundamental Ethical Controversies,1889
CRIIDO-6,Roger Crisp,Iv--the Dualism of Practical Reason,1996
KORTAA-2,ChristineM Korsgaard,Two Arguments Against Lying,1988
SHAREA-3,Robert Shaver,Rational Egoism: A Selective and Critical History,1998
HURCTF,Thomas Hurka,Common Themes From Sidgwick to Ewing,2011
SIDTTO,Henry Sidgwick,The Theory of Evolution in its Application to Practice,1876
SHASFF,Robert Shaver,Sidgwick's False Friends,1997
WUESAS,Julian Wuerth,Sense and Sensibility in Kant's Practical Agent: Against the Intellectualism of Korsgaard and Sidgwick,2013
SKEUPE,Anthony Skelton,Utilitarian Practical Ethics: Sidgwick and Singer,2011
BRISDO,David O. Brink,Sidgwick's Dualism of Practical Reason,1988
SCHHS-17,Bart Schultz,Henry Sidgwick - Eye of the Universe: An Intellectual Biography,2004
SKELUM,Anthony Skelton,"Late Utilitarian Moral Theory and its Development: Sidgwick, Moore",2019
SKEHSP,Anthony Skelton,Henry Sidgwick's Practical Ethics: A Defense,2006
SIDPCO,H. Sidgwick,Professor Calderwood on Intuitionism in Morals,1876
SKESS,Anthony Skelton,Schultz's Sidgwick,2007
THOGEM-2,Emily Thomas,"G e Moore?s Time Realism: Presentism, a-Theory, and the Ghost of Henry Sidgwick",2024
SHAREA-6,Robert Shaver,Rational Egoism: A Selective and Critical History,2009
MACSP-2,J. L. Mackie,Sidgwick's Pessimism,1976
FRASAT-2,William K. Frankena,Sidgwick and the Dualism of Practical Reason,1974
SIDEOE-2,Henry Sidgwick,Essays on Ethics and Method,2000
HENKAS,Tyler Paytas and Tim Henning,Kantian and Sidgwickian Ethics: The Cosmos of Duty Above and the Moral Law Within,2020
SIDLOT-2,Henry Sidgwick,"Lectures on the Ethics of T.H. Green, Mr. Herbert Spencer, and J. Martineau",1902
SHASAA-7,Robert Shaver,Sidgwick's Axioms and Consequentialism,2014
BRIOAD,David O. Brink,Objectivity and Dialectical Methods in Ethics,1999
HURSOC,Thomas Hurka,Sidgwick on Consequentialism and Deontology: A Critique,2014
CRISAI,Roger Crisp,Sidgwick and Intuitionism,2002
WILNTP,Bernard Williams,Nineteen. The Point of View of the Universe: Sidgwick and the Ambitions of Ethics,2006
SIDTPO,H. Sidgwick,The Philosophy of Common Sense,1895
EESTHG,E. E. Sheng,T. H. Green and Henry Sidgwick on Free Agency and the Guise of the Good,forthcoming
SCHEOH-5,Bart Schultz,Essays on Henry Sidgwick,1992
SIDPEA-3,Henry Sidgwick,Practical Ethics: A Collection of Addresses and Essays,1898
SVESM,Steven Sverdlik,Sidgwick's Methodology,1985
RASPSU,Hastings Rashdall,Professor Sidgwick's Utilitarianism,1885
MCLWIS-2,Owen McLeod,What is Sidgwick's Dualism of Practical Reason?,2000
PHISDA,David Phillips,"Sidgwick, Dualism and Indeterminacy in Practical Reason",1998
ROBSMM,Robert Shaver,Sidgwick's Minimal Metaethics,2000
HURUDB,Thomas Hurka,Underivative Duty: British Moral Philosophers From Sidgwick to Ewing,2011
SIDTFO,H. Sidgwick,The Feeling-Tone of Desire and Aversion,1892
COFTGR,Nathan Cofnas,The Golden Rule: A Naturalistic Perspective,2022
BRASAC,Brad Hooker,Sidgwick and Common?Sense Morality,2000
FREASO,R. G. Frey,Act-Utilitarianism: Sidgwick or Bentham and Smart?,1977
HENU,Henry Sidgwick,Utilitarianism,2000
SCHHS-3,Bartonn D. Schultz,Henry Sidgwick,2008
Okuno2011-NAKSAC,Mariko Nakano{-}Okuno,Sidgwick and Contemporary Utilitarianism,2011
DEISE,John Deigh,Sidgwick's Epistemology,2007
STESCA-3,Stephen Darwall,"Sidgwick, Concern, and the Good",2000
DARPAU,Stephen L. Darwall,Pleasure as Ultimate Good in Sidgwick?s Ethics,1974
SHASOM,Robert Shaver,Sidgwick on Moral Motivation,2006
CREEAO,Sergio Cremaschi,Elizabeth Anscombe on Consequentialism and Absolute Prohibitions,2012
SKESAK,Anthony Skelton,Practical Ethics in Sidgwick and Kant,2020
EDWAOF,Terence Rajivan Edward,"Another Objection From Sidgwick to Rawls?s Liberty Principle, and a Response",manuscript
CREU-2,Sergio Volodia Marcello Cremaschi,Utilitarismo,2006
EDWHSO,Terence Rajivan Edward,Henry Sidgwick on Freedom as the Formula for Justice,manuscript
CRIPAH,Roger Crisp,Pleasure and Hedonism in Sidgwick,2011
SKEROD,Anthony Skelton,Sidgwick?s Argument for Utilitarianism and His Moral Epistemology: A Reply to David Phillips,2013
SCHSRE-3,Michael W. Schmidt,"Sidgwick, Reflective Equilibrium and the Triviality Charge",2021
RICCAA-2,Henry S. Richardson,Commensurability as a Prerequisite of Rational Choice: An Examination of Sidgwick's Position,1991
SKEOHS,Anthony Skelton,On Henry Sidgwick?s ?My Station and its Duties?,2014
MCLWIS-3,Mcleod Owen,What is Sidgwick?s Dualism of Practical Reason?,2000
CALMSO,H. Calderwood,Mr. Sidgwick on Intuitionalism,1876
ROSCPV,Ross Harrison,Cambridge Philosophers Vi: Henry Sidgwick,1996
HAYTTS-4,F. H. Hayward,"The True Significance of Sidgwick's ""Ethics""",1901
SETTES,James Seth,The Ethical System of Henry Sidgwick,1901
HAYMHE-3,F. H. Hayward,Mr. Hayward's Evaluation of Professor Sidgwick's Ethics: A Reply,1901
SKEHR-2,Anthony Skelton,"Rashdall, Hastings (1858-1924)",2013
EDWTDT-2,Terence Rajivan Edward,The Descriptivist Theory of Names and the Problem of Paradoxical Reputations,manuscript
EDWWEN-2,Terence Rajivan Edward,What ?Everyone? Needs to Know? Sidgwick and Hart Against the Priority of Liberty,manuscript
CREABP,Sergio Volodia Marcello Cremaschi,As Boys Pursue the Rainbow. Whewell?s Independent Morality Vs. Sidgwick?s Dogmatic Intuitionism,2011
JEZROK,Nathaniel Jezzi,Rawls on Kantian Constructivism,2016
SKEHS,Anthony Skelton,"Henry Sidgwick, 1838-1900",2002
SCHBRD-7,Bart Schultz,"Book Reviews Phillips , David . Sidgwickian Ethics New York: Oxford University Press, 2012. Pp. Xii+163. \$65.00 (Cloth)",2012
SCHMAS-3,Bart Schultz,"Mill and Sidgwick, Imperialism and Racism",2007
ORSTMG-2,Francesco Orsi,The Modern Guise of the Good,2021
SKEITS,Anthony Skelton,Symposium on David Phillips's Sidgwickian Ethics: Introduction,2013
SHATPO-49,Robert Shaver,The Point of View of the Universe: Sidgwick and Contemporary Ethics,2015
BARTSO-6,Alfred Barratt,The ?Suppression' of Egoism,1877
HURBSE,Thomas Hurka,"Bart Schultz, Ed., Essays on Henry Sidgwick Reviewed By",1992
TJOGHL,Hock Guan Tjoa,George Henry Lewes: A Victorian Mind,1977
SIDPIS,Henry Sidgwick,"Philosophy, its Scope and Relations",1902
ALITSO-2,Alison Hills,The Significance of the Dualism of Practical Reason,2003
MILSAR-13,David Miller,Sidgwick and Rawls on Distributive Justice and Desert,2021
SIDTPO-2,H. Sidgwick,The Philosophy of T. H. Green,1901
SINTMM-3,Marcus G. Singer,The Many Methods of Sidgwick?s Ethics,1974
DONSAW,Alan Donagan,Sidgwick and Whewellian Intuitionism: Some Enigmas,1977
JONISE,E. E. C. Jones,Iii.--Professor Sidgwick's Ethics,1904
SIDMSE,Henry Sidgwick,Mr. Spencer's Ethical System,1880
DEISOE,John Deigh,Sidgwick on Ethical Judgment,1992
JOHDAW,John Skorupski,Desire and Will in Sidgwick and Green,2000
SCHHS-8,Bart Schultz,Henry Sidgwick,2000
BLASTM,Brand Blanshard,Sidgwick the Man,1974
SIDTRO-6,H. Sidgwick,The Relation of Ethics to Sociology,1899
SCHSAT-21,J. B. Schneewind,Sidgwick and the Cambridge Moralists,1974
SIDCOT,Henry Sidgwick,Criteria of Truth and Error,1900
ROGSAS,Roger Crisp,Sidgwick and Self-Interest,1990
ROBHSR,Robert Shaver,Henry Sidgwick (Review),2003
LILOTE,Hallvard Lillehammer,On the Ethics of Naturalism: Sorley and Sidgwick on Ethics and Evolution,2021
BAREBA-7,Walter Barta,Epistemic Barriers and Practical Dualism,manuscript
BARHSA,Giuseppe Barreca,Henry Sidgwick and the Disagreement Between Egotism and Utilitarianism,2007
MCCJSM-7,Helen McCabe,John Stuart Mill?s View on Democracy and Government in Gregory Conti?s \emph{Parliament the Mirror of the Nation},2023
FOWPSO,T. Fowler,"Professor Sidgwick on ""Progressive Morality""",1885
SKEHS-2,Anthony Skelton,"Henry Sidgwick, 1838-1900",2010
SCHS-18,Bart Schultz,Sidgwick,2013
EMBPTI,Dallas Willard and Barry Smith,Phenomenological Tendencies in British Moral Theory,1995
SEITPB-3,Christian Seidel,The Philosophical Biography of the Utilitarian Tradition: Is Sidgwick a Point of Culmination?,2020
SIDMSO,Henry Sidgwick,Mr. Sidgwick on ?Ethical Studies',1877
DUFTRO-8,Annette Dufner,The Role of Kant in Sidgwick?s Classical Utilitarianism: Two Self-Evident Axioms and the Partial Convergence Between Kantianism and Utilitarianism,2022
ORSTDO,Francesco Orsi,The Dualism of the Practical Reason: Some Interpretations and Responses,2008
SINHJA,Jane Singleton,"Henry James--Aristotle's Ally, an Exclusive Pact?",2006
PHISOP,David Phillips,Sidgwick on Promises,2010
ORSSAT,Francesco Orsi,Sidgwick and the Morality of Purity,2012
DEEEOH,Richard Dees,Essays on Henry Sidgwick,1994
FRATMO-29,William K. Frankena,"The Methods of Ethics, Edition 7, Page 92, Note 1: William K. Frankena",2000
ROBAFC-4,George W. Roberts,"A Fudamental Contradiction in Sidgwick's ""the Methods of Ethics""",1969
LUIRDL,Jos\'e Ram\'{o}n Curbera Luis,"Rese\~{n}a de Lazari-Radek, Katarzyna; Singer, Peter. The Point of View of the Universe: Sidgwick and Contemporary Ethics, Oxford, Oxford University Press, 2014",2022
DONHAM,Leonard Doncaster,"Heredity and Memory, Being the Henry Sidgwick Memorial Lecture, 1912",1914
BARGAS,G. F. Barbour,Green and Sidgwick on the Community of the Good,1908
SIDMSA-3,Henry Sidgwick,My Station and its Duties,1893
SIDTEO-11,H. Sidgwick,The Ethics of Religious Conformity,1896
DEISFT,John Deigh,Some Further Thoughts on Sidgwick's Epistemology,2010
SCHSIM-2,Jerome B. Schneewind,Sidgwick I Morali\'{s}ci Z Cambridge,2008
NETHS,R. L. Nettleship and T. H. Green,Henry Sidgwick,1908
SIDKTO-2,H. Sidgwick,Kant's Theory of Mathematics,1883
CURACA,David A. Curtis,A Class and State Analysis of Henry Sidgwick's Utilitarianism,1986
SIDUA,H. Sidgwick,Unreasonable Action,1893
MACSAS-13,Michael Macmillan,Sidgwick and Schopenhauer on the Foundation of Morality,1898
BARSF,Bart Schultz,Sidgwick's Feminism,2000
PELDAD,Gianfranco Pellegrino,Dieci Anni di Studi Su Henry Sidgwick,2003
CRIMEU-2,Roger Crisp,"Metaphysics, Epistemology, Utilitarianism, Intuitionism, and Egoism: A Response to Phillips on Sidgwick",2013
SIDOTF,H. Sidgwick,On the Fundamental Doctrines of Descartes,1882
BALNAE-3,Arthur James Balfour,Naturalism and Ethics,1894
SCHUDB-2,Bart Schultz,Underivative Duty: British Moral Philosophers From Sidgwick to Ewing,2012
HARCAT-27,Russell Hardin,Commonsense at the Foundations,1992
SIDMAC,H. Sidgwick and L. Carrau,Moralistes Anglais Contemporains: M. H. Sidgwick,1878
LAGSEA,A. R. Lagey,Sidgwick's Ethics and Victorian Moral Philosophy,1978
DAVSIE,Michael Davis,Sidgwick?s Impractical Ethics,1998
SIDHSG,Arthur Sidgwick,Henry Sidgwick,1906
STUONA,H. Sturt,Obituary Notices: Alfred Sidgwick,1944
PRISPE,Michael S. Pritchard,Sidgwick?s Practical Ethics,1998
IRWTDO-2,Terence Irwin,"The Development of Ethics, Volume 3: From Kant to Rawls",2007
CRISIG,Roger Crisp,Sidgwick I Granice Intuicjonizmu,2008
SIDR,Henry Sidgwick,"Reviews, 1871-1899",1871
SINEOH,Peter Singer,Essays on Henry Sidgwick,1999
MARPSO,James Martineau,"Professor Sidgwick on ""Types of Ethical Theory""",1885
BERBSA-4,Christopher J. Berry,Between Science and Religion: The Reaction to Scientific Naturalism in Late Victorian England,1981
SIDADO,H. Sidgwick,A Dialogue on Time and Common Sense,1894
SORHS,W. R. Sorley,Henry Sidgwick,1901
PHIRTC,David Phillips,"Replies to Crisp, Shaver and Skelton",2013
HSIVCN,H. Sidgwick,Vi. --Critical Notices,1882
PAYBGO,Tyler Paytas,Beneficent Governor of the Cosmos: Kant and Sidgwick on the Moral Necessity of God,2020
HAYTEP-4,Frank Herbert Hayward,The Ethical Philosophy of Sidgwick,1901
LEPHSA,Chiara Leproni,"Henry Sidgwick and Arthur Hugh Clough: God, Duty and the Problem of the Action",2010
GRESEI-2,Lorenzo Greco,Sidgwick e Il Fallimento Dell?Etica Scientifica. Commento a Cremaschi,2006
SIDL-5,H. Sidgwick,Luxury,1894
REASAT-2,C. Read,"Sidgwick, A. -The Process of Argument",1894
SINHST,Peter Singer,"--Henry Sidgwick, the Methods of Ethics",unknown
FOWSFE,T. Fowler and L. A. Selby{-}Bigge,Some Fundamental Ethical Controversies,1890
SIDGE,Henry Sidgwick,Green's Ethics,1884
STETOO-7,Mark Steadman,The Organisation of Knowledge in Victorian Britain,2009
SCASHH,Juliane Scariot,"Sidgwick, Henry. Hist\'{o}ria da \'{E}tica",2012
KOCSEA,Donald F. Koch,Sidgwick's Ethics and Victorian Moral Philosophy,1981
PELLFE-2,Gianfranco Pellegrino,L'etica Filosofica e la Spiegazione Del Senso Comune in Henry Sidgwick,2000
SIDPAC,Henry Sidgwick,Philosophy at Cambridge,1876
JONMHE-3,E. E. Constance Jones,Mr. Hayward's Evaluation of Professor Sidgwick's Ethics,1901
LIPIDO,Robert Lipkin,In Defense of Sidgwick,1967
DEWHSP,J. Dewey,"H. Sidgwick, Philosophy, its Scope and Relations",1887
BALTPO,Arthur James Balfour,The Philosophy of Ethics,1878
HARHS-6,Ross Harrison,Henry Sidgwick,2001
SIDMBO,H. Sidgwick,"Mr. Barratt on ""the Suppression of Egoism""",1877
SISHSP,Sissela Bok,Henry Sidgwick's Practical Ethics,2000
GARWSP,J. L. A. Garcia,Why Sidgwick's Project Had to Fail,1987
SIDICO,Henry Sidgwick,Iv.--A Criticism of the Critical Philosophy,1883
RAPSOI,D. D. Raphael,Sidgwick on Intuitionism,1974
JAMHSS,David Gwilym James,Henry Sidgwick: Science and Faith in Victorian England,1970
SCHEOT-28,Bart Schultz,Eye of the Universe: Henry Sidgwick and the Problem Public,2002
SINEOH-2,Marcus G. Singer,Essays on Henry Sidgwick,1999
MARPSO-7,J. Martineau,Prof. Sidgwick on Types of Ethical Theory,1886
SIDCN,H. Sidgwick,Critical Notices,1895
WELGEM,Jennifer Welchman,G. E. Moore and the Revolution in Ethics: A Reappraisal,1989
ROBKVO,Robert Adamson,Kant's View of Mathematical Premisses and Reasonings,1883
DUFSAD,Dufay Dufay,"Sidgwick, A. -Distinction and the Criticism of Beliefs",1876
PEDGGU,Joyce Senders Pedersen,Girls Growing Up in Late Victorian and Edwardian England,1987
Radek2014-DELSEB-2,Katarzyna De Lazari{-}Radek,"Sidgwickian Ethics, by David Phillips",2014
BAIMSM,A. Bain,Mr. Sidgwick's Methods of Ethics,1876
SCHSOP-7,Robert C. Schultz,Sidgwick on Proof in Ethics,1975
CARPSA-2,George R. Carlson,"Parfit, Sidgwick, and Divided Reason",1988
SIDLOT,Henry Sidgwick,Lectures on the Philosophy of Kant,1905
TERHSL,Michel Terestchenko,Henry Sidgwick le Cosmos de la Moralit\'e R\'{e}duit au Chaos,2004
JOHMAO,John Wardle,Miss Anscombe on Sidgwick's View of Humility,1983
DAUSOM,Janice Daurio,Sidgwick on Moral Theories and Common Sense Morality,1997
ALAANS,Alan Donagan,A New Sidgwick:Sidgwick's Ethics and Victorian Moral Philosophy. J. B. Schneewind,1980
SCHHSE-4,Bart Schultz,"Henry Sidgwick, Essays on Ethics and Method Reviewed By",2001
SINOSR,A. Sinha,On Sidgwick's Reconciliation of Ethical Theories,1976
SIDHAU,H. Sidgwick,Hedonism and Ultimate Good,1877
STEUDB-2,G. Sterling,"Underivative Duty: British Moral Philosophers From Sidgwick to Ewing, Edited by Thomas Hurka",2015
SCHBET-2,Bart Schultz,"British Ethical Theorists From Sidgwick to Ewing, by Hurka, Thomas: Oxford: Oxford University Press, 2014, Pp. Xiv+ 310, \pounds30",2016
SINCSA,Marcus G. Singer,Common Sense and Paradox in Sidgwick's Ethics,1986
MANTDO-3,J. Mander and A. P. F. Sell,The Dictionary of Nineteenth-Century British Philosophers,2002
SHASOV-2,Robert Shaver,Sidgwick on Virtue,2008
PELSEL-2,Gianfranco Pellegrino,Sidgwick e la Difesa Dell?Utilitarismo. Commento a Cremaschi,2006
JONMMO-3,E. E. C. Jones,Mr. Moore on Hedonism,1906
SIDTMO-8,Henry Sidgwick,The Morality of Strife,1890
DITJSM,Erwin Ditz,Julius Schultz' Maschinen-Theorie des Lebens,1937
BARARC,Henry Barker,A Recent Criticism of Sidgwick's Methods of Ethics,1902
Richardson2013-OSSPOI,Anthony Ossa{-}Richardson,Possession or Insanity?: Two Views From the Victorian Lunatic Asylum,2013
HAVHS,William C. Havard,Henry Sidgwick \& Later Utilitarian Political Philosophy,1959
SIDME,Henry Sidgwick,"Miscellaneous Essays, 1870-1899",1871
LANTIO-4,William Langenfus,"The Impossibility of Sidgwick's ""Proof""",2000
DEISCO,John Deigh,Sidgwick's Conception of Ethics,2004
BROHS-4,C. D. Broad,Henry Sidgwick,1938
SIDIOE,H. Sidgwick,Incoherence of Empirical Philosophy,1882
RASPHS,Hastings Rashdall,Prof. [H.] Sidgwick's Utilitarianism,1885
SIDTAP-2,H. Sidgwick,Theory and Practice,1895
SCHFPA-2,J. B. Schneewind,First Principles and Common Sense Morality in Sidgwick?s Ethics,1963
MARRHE,Marcus G. Singer,"Ross Harrison, Ed., Henry Sidgwick:Henry Sidgwick",2003
BRAMSH,Francis Herbert Bradley and Henry Sidgwick,Mr. Sidgwick's Hedonism: An Examination of the Main Argument of 'the Methods of Ethics',1877
Gillet2015-STECC-6,Suzanne Stern{-}Gillet,Colloquium 5 Commentary on Schultz,2015
WHITAA-11,Nicholas White,The Attractive and Imperative: Sidgwick's View of Greek Ethics,1992
SIDTSI,Henry Sidgwick,The so-Called Idealism of Kant,1879
BARHSP,Bart Schultz,"Henry Sidgwick, Practical Ethics: A Collection of Addresses and Essays:Practical Ethics: A Collection of Addresses and Essays",1999
SHASER,Robert Shaver,Sidgwickian Ethics (Review),2013
PEDLIA,Joyce Pedersen,Liberal Ideals and Feminist Organisation in Victorian England: One Cause or Many?,1994
SIDTHM,H. Sidgwick,The Historical Method,1886
LEWSAD,G. H. Lewes,"Sidgwick, A. -Distinction and the Criticism of Beliefs",1876
BAISAT-2,A. Bain,"Sidgwick, A. -The Process of Argument",1878
CATAST-3,J. M. Cattell,"A. Sidgwick, the Use of Words in Reasoning",1886
REIOMK,Massimo Reichlin,Ordinary Moral Knowledge and Philosophical Ethics in Sidgwick and Kant,2008
DAUTRO-2,Janice Daurio,"The Role of the Distinction Between Method and Principle and the Place of Common Sense Morality in Henry Sidgwick's ""the Methods of Ethics""",1994
ALBAEO,Ernest Albee,An Examination of Professor Sidgwick's Proof of Utilitarianism,1901
SINSAN,Marens G. Singer,Sidgwick and Nineteenth Century British Ethical Thought,1992
MIKSWY,Joanna Miksa,"Sidgwick Wiecznie \.{Z}ywy? (Henry Sidgwick, Red. R. Harrison,)",2008
FRASH-2,L. Franco,"Sidgwick, Henry (1838-1900) and Kant Moral-Philosophy",1995
PICSME,Emmanuel Picavet,"Sidgwick, Moore Et l'Approche \'{E}conomique de l'Utilit\'e des R\`{e}gles Ordinaires",2005
SINDUB-3,A. G. Sinclair,Der Utilitarismus Bei Sidgwick Und Spencer..,1907
SKOJSS,John Skorupski,"J.B. Schneewind, ""Sidgwick's Ethics and Victorian Moral Philosophy""",1979
HOLSP-2,David M. Holley,Sidgwick's Problem,2002
JONSAD,C. C. Jones,"Sidgwick, A. -Distinction and the Criticism of Beliefs",1892
LOUBSA-2,A. R. Louch,Between Science and Religion: The Reaction to Scientific Naturalism in Late Victorian England,1975
OSUTIO,L. D. O?Sullivan,The Importance of Being Earnest: The Continuing Influence of Sidgwick?s Ethics,2002
ARLSEM,A. R. Lacey,Sidgwick's Ethical Maxims,1959
GOMSAO,Paul Gomberg,Self and Others in Bentham and Sidgwick,1986
BUCPOT-2,Placido Bucolo and Roger Crisp and Bart Schultz,"Atti Del Secondo Congresso Internazionale Su Henry Sidgwick: Etica, Psichica, Politica",2011
SIDKRO,Henry Sidgwick and Edward Caird,Kant's Refutation of Idealism,1880
SWEBEO,William Sweet,Biographical Encyclopedia of British Idealism,2010
RASPSO-4,H. Rashdall,Professor Sidgwick on the Ethics of Religious Conformity: A Reply,1897
ADAMHS,R. Adamson,Mr. H. Sidgwick on the Critical Philosophy,1883
MCCHS-6,H. C. McCauley,Henry Sidgwick,1974
BRAMSO,F. H. Bradley,Mr. Sidgwick on Ethical Studies,1877
SIDDUU,Henry Sidgwick,Der Utilitarismus Und Die Deutsche Philosophie: Texte Zur Ethik Und Philosophiegeschichte,2019
STEHS-2,Leslie Stephen,Henry Sidgwick,1901
PHISE-4,David Phillips,Sidgwickian Ethics ? an Overview,2013
MACSAD-3,J. S. Mackenzie,"Sidgwick, A. -Distinction and the Criticism of Beliefs",1892
DURSUA,Kevin K. J. Durand,Sidgwick's Utility and Whitehead's Virtue: Metaphysics and Morality,2002
BARRHE,Bart Schultz,"Ross Harrison , Henry Sidgwick, Oxford, Oxford University Press, 2001, Pp. Vi + 122",2002
PEDTEO-3,Js Pedersen,The Education of Women in Victorian and Edwardian England,1987
HENIIE,Henry Sidgwick,Idiopsychological Ethics,1887
RENHSI,Massimo Renzo,Henry Sidgwick's Indirect Utilitarianism,2008
JONAST-2,E. E. C. Jones,"A. Sidgwick, the Use of Words in Reasoning",1902
Radek2008-DELTMO-5,K. de Lazari{-}Radek,"The Methods of Ethics Henry Sidgwicka, Czyli Poszukiwanie \'{S}wieckiej Moralno\'{s}ci",2008
BALDHS,Arthur James Balfour,Decadence. Henry Sidgwick Memorial Lecture,1908
SCHTCO-147,Bart Schultz,The Cosmos of Duty: Henry Sidgwick?s Methods of Ethics by Roger Crisp,2016
HARBSE,R. Harrison,Bart Schultz: Essays on Henry Sidgwick,1996
CATHPB,Maggie Catterall,Henry Parkes [Book Review],2013
TINHS,J. Tinbergen,Henry Schultz,1939
ALBARC,Ernest Albee,A Recent Criticism of Sidgwick's Methods of Ethics: Rejoinder,1902
SIDHSC,Henry Sidgwick,Henry Sidgwick Collected Essays and Reviews,1998
Pattison1903-PRIHSP,A. Seth Pringle{-}Pattison,"H. Sidgwick, Philosophy, its Scope and Relations",1903
IRWGBA,T. H. Irwin,"Green, Bradley and Sidgwick",2010
SINEOE-2,Marcus G. Singer,Essays on Ethics and Method,2000
SHAUAE,Robert Shaver,Utilitarianism and Egoism in Sidgwickian Ethics,2013
PHIGSA,David Phillips,"Gert, Sidgwick, and Hybrid Theories of Rationality",2001
HSIN,H. Sidgwick,Notes,1877
CRENTI,Sergio Cremaschi,?Nothing to Invite or to Reward a Separate Examination?: Sidgwick and Whewell,2008
CRESEI,Sergio Cremaschi,Sidgwick e Il Progetto di Un?Etica Scientifica,2006
HAYTEP-2,Frank Herbert Hayward,"The Ethical Philosophy of [H.] Sidgwick, 9 Essays",1901
GRAFAL,John Campbell Graham,"Fast and Loose in Theology: Henry Sidgwick, Hastings Rashdall, and the Report of the Archbishops' Commission",1938
JOHCSM-3,Stephen Heber Johnson,"Common Sense Morality and ""Proof"" of First Principles in Henry Sidgwick",1976
DURTRO-8,Kevin Karl Jones Durand,"The Role of Metaphysics, Common-Sense, and Interpretations of Classical Greek Philosophy in Sidgwick's Utilitarianism and Whitehead's Virtue Ethics",2000
SCHRPI-5,Robert Charles Schultz,"Reason, Philosophical Intuitionism, and Justification in Sidgwick's Ethics",1969
NEWSCS,J. David Newell,Sidgwick?s Common Sense Realism,1979
TAYTRA-4,Frank Simmons Taylor,The Right and the Good in the Ethics of Henry Sidgwick,1969
LANSBK,Landsberg Landsberg,"Schultz, Bruno K., Erbkunde, Rassenkunde, Rassenpflege",1935
NEWTPO-10,James David Newell,The Philosophy of Henry Sidgwick,1975
GUMSHT,Gumperz Gumperz,"Schultz, Henry, Theory and Measurement of Demand",1939
RITHSA,William Ritchie,Henry Sidgwick and the Construction of Nineteenth Century Liberalism,1973
KIDMPA,Joel Holloway Kidder,"Methods, Principles and Knowledge in the Ethical Philosophy of Henry Sidgwick",1968
HEIDPD,Rudolf Heinz,"Das Proplem des Kategorialen Denkens. Zur Kausalit\""{a}tsdiskussion Im Positivismus (Laas, Jodl, Schultz, Austeda)",1971
SIDHSA-2,Arthur Sidgwick,"Henry Sidgwick, a Memoir by A.S. And E.M.S",1906
VANSCS-2,William Stevens Vanderploeg,"Sidgwick, Common Sense, and the Dualism of Practical Reason",1976
KILSPE,Paul Chester Killam,Some Problems Encountered in Sidgwick's Utilitarianism,1962
BENTBO-12,Paula J. Erdwinn Benson,The Basis of the Conflict Between Self-Interest and Duty in Henry Sidgwick's 'Methods of Ethics.',1971
SKEROD-3,Anthony Skelton,"Review of David Phillips, Sidgwick's \emph{the Methods of Ethics}: A Guide",2022
CRESHI,Sergio Volodia Marcello Cremaschi,"Sidgwick, Henry, I Metodi Dell'etica, Ed. By Maurizio Mori.",1996
CRESCE,Sergio Volodia Marcello Cremaschi,"Sentimentalismo, Consequenzialismo, Etica Laica",2002
