ID,Author,Title,Year
ALTLAP,Louis Althusser,"Lenin and Philosophy, and Other Essays",1971
CASWIF,Cornelius Castoriadis,"World in Fragments: Writings on Politics, Society, Psychoanalysis, and the Imagination",1997
USHPAE,Robin Usher,Postmodernism and Education,1994
CORTPO-5,Drucilla Cornell,The Philosophy of the Limit,1992
EVAAID,Dylan Evans,An Introductory Dictionary of Lacanian Psychoanalysis,1996
BRYTDO-2,Levi R. Bryant,The Democracy of Objects,2011
STOAIT-13,Alison Stone,An Introduction to Feminist Philosophy,2007
GROJLA,Elizabeth A. Grosz,Jacques Lacan: A Feminist Introduction,1990
JAMVOT,Fredric Jameson,Valences of the Dialectic,2009
IEKHTR,Slavoj Z?iz?ek,How to Read Lacan,2006
STALAT-5,Yannis Stavrakakis,Lacan and the Political,1999
ALTEOI,Louis Althusser,Essays on Ideology,1976
BLAINC,Jack Black,"Desire, Drive and the Melancholy of English Football: 'It's (Not) Coming Home'",2023
DERROP-2,Jacques Derrida,Resistances of Psychoanalysis,1998
OLIWNP-2,Kelly Oliver,"Womanizing Nietzsche: Philosophy's Relation to the ""Feminine""",1994
COPRMD,Joan Copjec,Read My Desire: Lacan Against the Historicists,1994
BLATPO-78,Jack Black,The Psychosis of Race: A Lacanian Approach to Racism and Racialization,2023
CHISAO-3,Lorenzo Chiesa,Subjectivity and Otherness: A Philosophical Reading of Lacan,2007
BADLAM-2,Alain Badiou,Lacan: Anti-Philosophy 3,2018
BOLTSO-3,Christopher Bollas,The Shadow of the Object: Psychoanalysis of the Unthought Known,1987
WILMEA-8,Cynthia Willett,Maternal Ethics and Other Slave Moralities,1995
SHATWI-2,Michal Shapira,"The War Inside: Psychoanalysis, Total War, and the Making of the Democratic Self in Postwar Britain",2013
ROGEKE,Chandler D. Rogers,Estranged Kinship: Empathy and Animal Desire in Merleau-Ponty,2024
ZUPEOT,Alenka Zupanc?ic?,"Ethics of the Real: Kant, Lacan",2000
BOODAD-2,Richard Boothby,Death and Desire : Psychoanalytic Theory in Lacan's Return to Freud,2015
ALTOI,Louis Althusser,On Ideology,2008
RAJTAE,John Rajchman,"Truth and Eros: Foucault, Lacan, and the Question of Ethics",1991
KHUDDD,Thomas Khurana,Die Dispersion des Unbewussten. Drei Studien Zu Einem Nicht-Substantialistischen Konzept des Unbewussten: Freud ? Lacan ? Luhmann,2002
SILTTO,Kaja Silverman,The Threshold of the Visible World,1996
WINQF-2,Shannon Winnubst,Queering Freedom,2006
BOUWRF,Jacques Bouveresse,Wittgenstein Reads Freud: The Myth of the Unconscious,1995
BLAPTI-5,Jack Black and Jim Cherrington,Posthuman to Inhuman: Mhealth Technologies and the Digital Health Assemblage,2022
BLALTS-3,Jack Black,"""Love Thy Social Media!"": Hysteria and the Interpassive Subject",2022
ROSIRI-3,George Rossolatos,Interdiscursive Readings in Cultural Consumer Research,2018
BLARRA-6,Jack Black,"Race, Racism and Political Correctness in Comedy - a Psychoanalytic Exploration",2021
COPITN,Joan Copjec,Imagine There's No Woman: Ethics and Sublimation,2004
SHATS,Philip Shaw,The Sublime,2006
CHAMGA,David Chai,Meontological Generativity: A Daoist Reading of the Thing,2014
GOOOLP,Peter Goodrich,"Oedipus Lex: Psychoanalysis, History, Law",1995
BREHAL-2,Teresa Brennan,History After Lacan,1993
BUETDS,Filip Buekens and Maarten Boudry,The Dark Side of the Loon. Explaining the Temptations of Obscurantism,2014
DOLTCD,Mladen Dolar,"Tyche, Clinamen, Den",2013
BLAJAG,Jack Black and Joseph S. Reynoso,Just a Game? Sport and Psychoanalytic Theory,2024
ZWATGA,Hub Zwart,The Genome as the Biological Unconscious ? and the Unconscious as the Psychic 'Genome': A Psychoanalytical Rereading of Molecular Genetics,2013
WINWTC,Shannon Winnubst,Way Too Cool: Selling Out Race and Ethics,2015
Jacobsen1991-BORLTA,Mikkel Borch{-}Jacobsen,Lacan: The Absolute Master,1991
JOHJL-2,Adrian Johnston,Jacques Lacan,2016
FUSESL-2,Diana J. Fuss,?Essentially Speaking?: Luce Irigaray's Language of Essence,1988
BLAPSA-4,Jack Black,"Play, Sport, and the Creativity of Sublimation: Understanding the Importance of Unimportant Activities (1st edition)",2024
NAATOT,Michael Naas,Taking on the Tradition: Jacques Derrida and the Legacies of Deconstruction,2002
JOHTDM-2,Adrian Johnston and Slavoj Zizek,Time Driven: Metapsychology and the Splitting of the Drive,2005
PLUSAA,Ed Pluth,Signifiers and Acts: Freedom in Lacan's Theory of the Subject,2007
EDWIOT-2,Terence Rajivan Edward,"Intransitivity of Translation, le D\'{e}bat, and the Primacy of the Signifier, by Ren*T* s*Lecl",manuscript
JOHBZA,Adrian Johnston,"Badiou, Zizek, and Political Transformations: The Cadence of Change",2009
DEKEAE-2,Marc De Kesel,Eros and Ethics: Reading Jacques Lacan's Seminar Vii,2009
JOHPTA-4,Adrian Johnston,Prolegomena to Any Future Materialism: The Outcome of Contemporary French Philosophy,2013
BOOFAP,Richard Boothby,Freud as Philosopher: Metapsychology After Lacan,2001
GOUSEA,Jean{-}Joseph Goux,Symbolic Economies: After Marx and Freud,1990
BLOPPB-3,Phillip Blond,Post-Secular Philosophy: Between Philosophy and Theology,1997
NEWFBT,Saul Newman,From Bakunin to Lacan: Anti-Authoritarianism and the Dislocation of Power,2001
Crooks2000-SESDWA-2,Kalpana Seshadri{-}Crooks,Desiring Whiteness: A Lacanian Analysis of Race,2000
FRISAI-3,Roger Frie,"Subjectivity and Intersubjectivity in Modern Philosophy and Psychoanalysis: A Study of Sartre, Binswanger, Lacan, and Habermas",1997
BADTNS,Alain Badiou and Barbara Cassin,There's No Such Thing as a Sexual Relationship: Two Lessons on Lacan,2017
ROGTEA,Jacob Rogozinski,The Ego and the Flesh: An Introduction to Egoanalysis,2010
LACL-2,Jacques Lacan,Lituraterre,2013
DESLBE,John Desmond,Levinas: Beyond Egoism in Marketing and Management,2007
LIUTCU,Lydia H. Liu,"The Cybernetic Unconscious: Rethinking Lacan, Poe, and French Theory",2010
OSUOTP,Simon O'Sullivan,On the Production of Subjectivity: Five Diagrams of the Finite-Infinite Relation,2012
FERPIT-4,Robin Ferrell,Passion in Theory: Conceptions of Freud and Lacan,1996
CRILAC-3,Simon Critchley and Oliver Marchart,Laclau: A Critical Reader,2004
BADJLP,Alain Badiou and Elisabeth Roudinesco,"Jacques Lacan, Past and Present: A Dialogue",2014
CUNGON,Conor Cunningham,Genealogy of Nihilism: Philosophies of Nothing and the Difference of Theology,2002
BLATDO-26,Jack Black,The Dialectic of Desire: Ai Chatbots and the Desire Not to Know,2023
SHITCT-3,Margrit Shildrick,The Critical Turn in Feminist Bioethics: The Case of Heart Transplantation,2008
BLAORR,Jack Black,"On Reflexive Racism: Disavowal, Deferment, and the Lacanian Subject",2020
ROTTES-8,Molly Anne Rothenberg,The Excessive Subject: A New Theory of Social Change,2010
PILTBA,Steve Pile,"The Body and the City: Psychoanalysis, Space, and Subjectivity",1996
CRATS,Mike Crang and N. J. Thrift,Thinking Space,2000
HOWTCC-3,Christina Howells,The Cambridge Companion to Sartre,1992
MACTUA-8,Alasdair C. MacIntyre,The Unconscious: A Conceptual Analysis,1976
BLASIF-2,Jack Black,Success in Failure: From the Destruction of the Tragic to the Self-Negation of the Comic,2023
GEOLAR-2,Sheldon George and Derek Hook,"Lacan and Race: Racism, Identity and Psychoanalytic Theory",2021
RONLWT,Ruth Ronen,Lacan with the Philosophers,2018
MCGSOT-8,S. J. McGrath,Schelling on the Unconscious,2010
HURDVL,Andrea Hurst,Derrida Vis-a?-Vis Lacan: Interweaving Deconstruction and Psychoanalysis,2008
MURLAD,Andrea Mura,Lacan and Debt,2015
SMIJLP-4,Jason E. Smith,"Jacques Lacan, Past and Present: A Dialogue",2014
NOBJLA,Dany Nobus,Jacques Lacan and the Freudian Practice of Psychoanalysis,2000
TAYEOP,Victor E. Taylor and Charles E. Winquist,Encyclopedia of Postmodernism,2001
LELLPA-2,Dorothy Leland,Lacanian Psychoanalysis and French Feminism: Toward an Adequate Political Psychology,1988
AOKSAM,Doug Aoki,Sex and Muscle: The Female Bodybuilder Meets Lacan,1996
DEWTPS-2,Peter Dews,"The Paradigm Shift to Communication and the Question of Subjectivity: Reflections on Habermas, Lacan and Mead",1995
KAUWTF,Eleanor Kaufman,Why the Family is Beautiful (Lacan Against Badiou),2002
BAZPAD,Ariane Bazan and Ramesh Kushwaha and E. Samuel Winer and J. Michael Snodgrass and Linda A. W. Brakel and Howard Shevrin,Phonological Ambiguity Detection Outside of Consciousness and its Defensive Avoidance,2019
HYMPAI,Michael Hymers,Philosophy and its Epistemic Neuroses,2000
FRIUEP,Roger Frie,Understanding Experience: Psychotherapy and Postmodernism,2003
SCHTFL-5,Jeanne Lorraine Schroeder,The Four Lacanian Discourses: Or Turning Law Inside Out,2008
ALTWOP-3,Louis Althusser,Writings on Psychoanalysis: Freud and Lacan,1999
ZWAMSA,Hub Zwart,"Medicine, Symbolization and the 'Real' Body: Lacan's Understanding of Medical Science",1998
LACOSA-2,Jacques Lacan,Of Structure as an Inmixing of an Otherness Prerequisite to Any Subject Whatever,1970
ROTFBP,Elizabeth Rottenberg,Foreign Bodies: Psychoanalysis and Neuroscience,2014
FRILAS,Roger Frie,Language and Subjectivity : From Binswanger Through Lacan,2003
IEKLTS,Slavoj Z?iz?ek,Lacan: The Silent Partners,2006
SOLLAT-5,Colette Soler,Lacanian Affects: The Function of Affect in Lacan's Work,2015
STEBDO-4,George Steinmetz,Bourdieu's Disavowal of Lacan: Psychoanalytic Theory and the Concepts of ?Habitus? and ?Symbolic Capital?,2006
PAVFTC,David Pavo?n Cue?llar,"From the Conscious Interior to an Exterior Unconscious: Lacan, Discourse Analysis, and Social Psychology",2010
SANPAS-6,Stella Sandford,Plato and Sex,2010
SADOOJ,Gregory Sadler,Outlines of Jacques Lacan?s Ethics of Subjectivity,2015
FROPCR,Stephen Frosh,"Psychoanalysis, Colonialism, Racism",2013
GOLNFT,Jan Goldstein,Neutralizing Freud: The Lyc\'{e}e Philosophy Class and the Problem of the Reception of Psychoanalysis in France,2013
WATMBR,Holly Watkins,Music Between Reaction and Response,2013
NEWPAP-2,Saul Newman,Power and Politics in Poststructuralist Thought: New Theories of the Political,2005
COPMTE,Joan Copjec,"May'68, the Emotional Month",2006
JOHNIN,Adrian Johnston,Nothing is Not Always No-One: Voiding Love,2005
MPITC,Modus Ponens Mp and Modus Tollens Mt,"If the Car is Green, Then It has Four-Wheel Drive. The Car has Either Four-Wheel Drive or Power Steering, but Not Both. What Can You Conclude? If You Make The",2005
SJOTAC,Cecilia Sjo?holm,The Antigone Complex: Ethics and the Invention of Feminine Desire,2004
ELLSTS,Anthony Elliott,Social Theory Since Freud: Traversing Social Imaginaries,2004
MACTRO-25,Juliet Flower MacCannell,The Regime of the Brother: After the Patriarchy,1991
BERIDC,Charles Bernheimer,In Dora's Case: Freud-Hysteria-Feminism,1990
SJOKAT,Cecilia Sjoholm,Kristeva and the Political,2004
EDEPTI,Michael Lavin,Psychoanalysis: Theory in Crisis,1992
ONETSB,John O'Neill,The Specular Body: Merleau-Ponty and Lacan on Infant Self and Other,1986
MALIR,Catherine Malabou,"Impossible Recognition : Lacan, Butler, \v{Z}i\v{z}ek",2012
BURFLA-2,Erica Burman,Fanon?s Lacan and the Traumatogenic Child: Psychoanalytic Reflections on the Dynamics of Colonialism and Racism,2016
LACLSE-2,Jacques Lacan,La Science Et la V\texttt{\char92}?Erite,1966
EDIEGJ,The Editors,"Elizabeth Grosz, Jacques Lacan",1989
LACRTS-3,Jacques Lacan,Responses to Students of Philosophy Concerning the Object of Psychoanalysis,1987
CHOWEW,Daniel Cho,"Wo Es War: Psychoanalysis, Marxism, and Subjectivity",2007
SOUFOP,Catherine M. Soussloff,Foucault on Painting,2011
RICIAA-7,Sinan Richards,?I Am a Clown?: Lacan's Difficult Literary Dandyism,2024
FREAIH,Charles Freeland,"Antigone, in Her Unbearable Splendor: New Essays on Jacques Lacan's the Ethics of Psychoanalysis",2013
MCIPTS,David W. McIvor,Pressing the Subject: Critical Theory and the Death Drive,2015
JOHGOS,Adrian Johnston,"Ghosts of Substance Past: Schelling, Lacan, and the Denaturalization of Nature",2006
SASLTM,Louis A. Sass,Lacan: The Mind of the Modernist,2015
BANTAO,Gary Banham,The Antimonies of Pure Practical Libertine Reason,2010
GRILAB,Russell Grigg,Lacan and Badiou: Logic of the Pas-Tout,2005
SLOGRJ,Sam Slote,"Gabriel Renggli, \emph{Joyce as Theory: Hermeneutic Ethics in Derrida, Lacan, and ?Finnegans Wake?}",2024
LAUBID,Teresa de Lauretis,Becoming Inorganic. David Cronenberg's e Xistenz and Freud's Theory of Drives,2003
ROUTMS,Elisabeth Roudinesco,The Mirror Stage: An Obliterated Archive,2003
SHELAP,Charles Shepherdson,Lacan and Philosophy,2003
EMETOW,Caryl Emerson,"The Outer Word and Inner Speech: Bakhtin, Vygotsky, and the Internalization of Language",1983
RAUTHM,Lauri Rauhala,The Hermeneutic Metascience of Psychoanalysis,1972
CAVFAP-2,Stanley Cavell,Freud and Philosophy: A Fragment,1987
BRADAJ,N\'{e}stor Braunstein,Desire and Jouissance in the Teachings of Lacan,2003
NOBLSO,Dany Nobus,Lacan's Science of the Subject: Between Linguistics and Topology,2003
KOVLOP,Filip Kovacevic,Liberating Oedipus?: Psychoanalysis as Critical Theory,2006
RUTTSO-3,Mari Ruti,The Singularity of Being:Lacan and the Immortal Within: Lacan and the Immortal Within,2012
DEKMOL,Marc De Kesel,Misers or Lovers? How a Reflection on Christian Mysticism Caused a Shift in Jacques Lacan?s Object Theory,2013
ZHATPV,Huaiyuan Zhang,The Parallax View Between Merleau?Ponty and Lacan: ?Never Do You Gaze at Me There Where I See You?,2023
LEHOSC,Turo{-}Kimmo Lehtonen and Olli Pyyhtinen,On Simmel?s Conception of Philosophy,2008
BRALRC-2,Pietro Braga,Le R\'{e}el Comme Mati\'{e}re Dans le Premier Enseignement de Jacques Lacan,2024
MARKYE-5,Jos\'e Miguel Marinas,Kant y El Reverso de la Ilustraci\'{o}n: Una Lectura \'{E}tica y Pol\'{i}tica de Lacan,2004
MOYTDD,Paul Moyaert,The Death Drive and the Nucleus of the Ego: An Introduction to Freudian Metaphysics,2013
JOHDBB-2,Adrian Johnston,Drive Between Brain and Subject: An Immanent Critique of Lacanian Neuropsychoanalysis,2013
HENGDL-2,Michel Henry,G\'{e}n\'{e}alogie de la Psychanalyse: Le Commencement Perdu,2011
BLASAT-8,Jack Black,Sport and the 'National Thing': Exploring Sport's Emotive Significance,2021
ZWATSO,Hub Zwart,The Symbolic Order and the Noosphere: Pierre Teilhard de Chardin and Jacques Lacan on Technoscience and the Future of the Planet,2022
DEGTSF,Richard T. De George,The Structuralists: From Marx to le?Vi-Strauss,1972
DEATSA,Carolyn Janice Dean,"The Self and its Pleasures: Bataille, Lacan, and the History of the Decentered Subject",1992
CAULAT,David Stanley Caudill,Lacan and the Subject of Law: Toward a Psychoanalytic Critical Legal Theory,1997
RABTCC,Jean{-}Michel Rabate?,The Cambridge Companion to Lacan,2003
FYNIFT,Christopher Fynsk,Infant Figures: The Death of the Infans and Other Scenes of Origin,2000
SADSLM-3,Gregory B. Sadler,Situating Lacan?s Mirror Stage in the Symbolic Order,2006
KAABKD,Erman Ka\c{c}ar,Bilincin K\i{}sa Devresi: Lacan?In Ayna Evresinden Descartes?In Cog\i{}to?Suna Do\u{g}ru Bir Polemik,2024
BILLMO,Michael Billig,Lacan?s Misuse of Psychology,2006
KIRHNT,Suzanne R. Kirschner,How Not to Other the Other (and Similarly Impossible Goals): Scenes From a Psychoanalytic Clinic and an Inclusive Classroom,2012
BLATAO-26,Jack Black,The Appearance of Authority in Health and Wellbeing Media: Analysing Digital Guru Media Through Lacan's 'Big Other',2022
ALPUSS,Dario Alparone,Una Soggettivit\`a Senza Interiorit\`a: Wittgenstein Con Lacan,2024
TROUSI,Gregory A. Trotter,Unconscious Structure in Sartre and Lacan,2018
JOHITO-3,Adrian Johnston,Irrepressible Truth: On Lacan's 'the Freudian Thing',2017
WILIAI-2,S. E. Wilmer and Audrone Zukauskaite,Interrogating Antigone in Postmodern Philosophy and Criticism,2010
JAGVAA,Jan Jagodzinski,Visual Art and Education in an Era of Designer Capitalism: Deconstructing the Oral Eye,2010
BLAAFO-2,Jack Black,"""a Form of Socially Acceptable Insanity"": Love, Comedy and the Digital in Her",2021
Cuellar2023-PAVLSL,David Pav\'{o}n{-}Cu\'{e}llar,"Lo Subvertido, Lo Forcluido y Lo Suturado: Una Historia Del Sujeto de Lacan a Badiou",2023
LEETAT-7,Claudia Leeb,Toward a Theoretical Outline of the Subject: The Centrality of Adorno and Lacan for Feminist Political Theorizing,2008
BALLS,\'{E}tienne Balibar,Le Structuralisme : Une Destitution du Sujet ?,2005
WOJWTC,Christopher Wojtulewicz and Graham J. McAleer,Why Technoscience Cannot Reproduce Human Desire According to Lacanian Thomism,2019
CODSSA,Lorraine Code,"Self, Subjectivity, and the Instituted Social Imaginary",2011
BLAAUO-2,Jack Black and Robert J. Lake and Thomas Fletcher,An Unnerving Otherness: English Nationalism and Rusedski's Smile,2021
EYELMA-2,Tom Eyers,Lacanian Materialism and the Question of the Real,2011
OROTAO,Michael O'Rourke,The Afterlives of Queer Theory,2011
WOJTAF,Christopher M. Wojtulewicz,Truth as Final Cause: Eschatology and Hope in Lacan and Przywara,2019
BLASOB-2,Jack Black,Slipping on Banana Skins and Falling Through Bars: 'True' Comedy and the Comic Character,2021
MILCAT-2,Mara Miller,Canons and the Challenge of Gender,1993
NORSAA-2,Birgit Nordtug,Subjectivity as an Unlimited Semiosis: Lacan and Peirce,2004
WINITM,Shannon Winnubst,Is the Mirror Racist?: Interrogating the Space of Whiteness,2004
FRAPAA-12,William Franke,Psychoanalysis as a Hermeneutics of the Subject,1998
Jacobsen1994-BORTOP,Mikkel Borch{-}Jacobsen and Douglas Brick,The Oedipus Problem in Freud and Lacan,1994
OLILST,Bert Olivier,"Lacan?s Subject: The Imaginary, Language, the Real and Philosophy",2004
AOKUAA,D. S. Aoki,Using and Abusing French Discourse Theory: Misreading Lacan and the Symbolic Order,1995
CHOBDT,Nancy Julia Chodorow,Beyond Drive Theory,1985
OLITLO-5,Kelly Oliver,The Look of Love,2001
CRIDDL,Simon Critchley,Das Ding: Lacan and Levinas,1998
BERLET,Rudolf Bernet,Loi Et \'{E}thique Chez Kant Et Lacan,1991
GILVAT,Grant Gillett,Virtue and Truth in Clinical Science,1995
LACPAM,Ernesto Laclau and Amy G. Reiter{-}McIntosh,Psychoanalysis and Marxism,1987
WINEHA-2,Shannon Winnubst,Exceeding Hegel and Lacan: Different Fields of Pleasure Within Foucault and Irigaray,1999
EMAMAL,Baraneh Emadian,Marx and Lacan: The Silent Partners (on Tomsic's the Capitalist Unconscious),2016
RAFRF,Fran\c{c}ois Raffoul and Eric S. Nelson,Rethinking Facticity,2008
EDWCAT-8,Terence Rajivan Edward,"Choice and the Invasion of Ukraine, by Ren*T* s*Lecl",manuscript
EDWEKX,Terence Rajivan Edward,"?Everyone Knows X?: Analytic Philosophy, Medicine, and Lacanian Psychoanalysis",manuscript
EDWESE,Terence Rajivan Edward,English Sensible Essayists: ?Mr. Everyman with Greater Strength of Character??,manuscript
GRIPA-2,Mark Griffith,Psychoanalysing Antigone,2010
LAMSTF,Kurt Lampe,?Socratic Therapy? From Aeschines of Sphettus to Lacan,2010
MOHNAP,Mohammadi Abolfazl and Momeni Javad,Non-Identity and Parodoxicality in Angela Carter?s the Bloody Chamber,2017
LEWDAL-2,Michael Lewis,Derrida and Lacan: Another Writing,2008
MURJLA-2,Martin Murray,Jacques Lacan: A Critical Introduction,2016
PLUSAA-2,Ed Pluth,Signifiers and Acts: Freedom in Lacan's Theory of the Subject,2008
CHITNL,Lorenzo Chiesa,The Not-Two: Logic and God in Lacan,2016
SHAUP,Matthew Sharpe and Joanne Faulkner,Understanding Psychoanalysis,2008
STEPOA-11,Jana Steinig and Ariane Bazan and Svenja Happe and Sarah Antonetti and Howard Shevrin,Processing of a Subliminal Rebus During Sleep: Idiosyncratic Primary Versus Secondary Process Associations Upon Awakening From Rem- Versus Non-Rem-Sleep,2017
AUMTHC,Rachel Aumiller,Twice-Two: Hegel?s Comic Redoubling of Being and Nothing,2018
SALHAB,Ali Salami and Mohsen Maleki,Hosna as Bride of Desire and Revolutionary Par Excellence in Tayib Salih?s the Season of Migration to the North,2016
MEYHOA,Johann{-}Albrecht Meylahn,Horkos [Oath] and the Sacrament of Language ? the Purloined Letter,2013
STALWL,Yannis Stavrakakis,Laclau with Lacan: Comments on the Relation Between Discourse Theory and Lacanian Psychoanalysis,2003
GILDFY,Benito Arbaizar Gil,"Descartes, Freud y Lacan: El Pasaje Al Acto y la Pesadilla",2023
MATTPO-63,Peter D. Mathews,The Pleasures of Unpleasure: Jacques Lacan and the Atheism Beyond the ?Death of God?,2023
SOTDAG,Francisco Conde Soto,Deleuze?s and Guattari?s Body Without Organs and Lacan?s Other Jouissance: Bodies Under Capitalism,2024
CROIOT,Clayton Crockett,Interstices of the Sublime: Theology and Psychoanalytic Theory,2007
BAUWAL,Rudolph Bauer,Winnicott and Lacan and the Lack Within Subjectivity in the Context of Dzogchen,2013
Sullivan1986-RAGJLA,Ellie Ragland{-}Sullivan,Jacques Lacan and the Philosophy of Psychoanalysis,1986
JOHCMJ,Adrian Johnston,Conflicted Matter: Jacques Lacan and the Challenge of Secularizing Materialism,2008
NEDDTB,Bos?tjan Nedoh,Does the Body Without Organs Have Any Sex at All? Lacan and Deleuze on Perversion and Sexual Difference,2016
HOLTCU,John Holland,The Capitalist Uncanny,2015
Sullivan2015-RAGLAT,Ellie Ragland{-}Sullivan and Mark Bracher,Lacan and the Subject of Language,2015
AGUICY,Pedro Karczmarczyk and Agust\'{i}n Palmieri,"Ideolog\'{i}a, Ciencia y Sujeto En Althusser, Pecheux y Lacan",2015
BUDPRO,Maro\vs Buday,"Philosophical (Re)Construction of Postmodern Identity Through the Teachings of Lacan, Heidegger and Plato",2023
TANTCO-25,Ian Tan,The Claim of Ethics: Language and the Other(Ness) of the Subject in Emmanuel Levinas and Jacques Lacan,2023
WOLTCO,Richard Wollheim,The Cabinet of Dr. Lacan,1991
BAUSOT,Rudolph Bauer,Seminar on the Fragmenting Body and the Freeing of Luminous Spaciousness to Be Embodied,2012
BERPAT-21,Leo Bersani,Psychoanalysis and the Aesthetic Subject,2006
HYLTDO,Kirsten Hyldgaard,The Discourse of Education--the Discourse of the Slave,2006
ETTMT,Bracha L. Ettinger,Matrixial Trans-Subjectivity,2006
STACAI-3,Yannis Stavrakakis,Creativity and its Limits: Encounters with Social Constructionism and the Political in Castoriadis and Lacan,2002
RABLAT,Bart Rabaey and Stijn Vanheule,Lacan and the Language of Mania. From Language Gone Mad to the Madness of Llanguage,2023
FREAIH-4,Charles Freeland,"Antigone, in Her Unbearable Splendor: New Essays on Jacques Lacan's the Ethics of Psychoanalysis",2014
MULBTP,John P. Muller,"Beyond the Psychoanalytic Dyad: Developmental Semiotics in Freud, Peirce, and Lacan",1996
CAMJLA,Kirsten Campbell,Jacques Lacan and Feminist Epistemology,2004
BUCMDC,Ian Buchanan,Michel de Certeau: Cultural Theorist,2000
HARLAL-3,Sarah Harasym,Levinas and Lacan: The Missed Encounter,1998
CAMAWT,Jan Campbell,"Arguing with the Phallus: Feminist, Queer, and Postcolonial Theory: A Psychoanalytic Contribution",2000
OLSIPA,Carl Olson,Indian Philosophers and Postmodern Thinkers: Dialogues on the Margins of Culture,2002
DICTOF,James DiCenso,"The Other Freud: Religion, Culture, and Psychoanalysis",1999
STRCEO,Elisabeth Strowick,"Comparative Epistemology of Suspicion: Psychoanalysis, Literature, and the Human Sciences",2005
SCHHOS-2,Bettina Schmitz and Translated By Julia Jansen,"Homelessness or Symbolic Castration? Subjectivity, Language Acquisition, and Sociality in Julia Kristeva and Jacques Lacan",2005
CIFNAS,Michael Christian Cifone,Nothngness and Science,2014
SCOBLA-2,Tim Scott,"Bourdieu, Lacan and Field Theory: Neoliberal Doxa in the Economic Field",2024
TINAAT,Tina Chanter,Abjection and the Constitutive Nature of Difference: Class Mourning in \emph{Margaret's Museum} and Legitimating Myths of Innocence in \emph{Casablanca},2006
GARSTS-2,Sebastian Gardner,"Splitting the Subject: An Overview of Sartre, Lacan and Derrida",unknown
JONCPA-2,James William Jones,Contemporary Psychoanalysis and Religion: Transference and Transcendence,1991
GALTDS-3,Jane Gallop,The Daughter's Seduction: Feminism and Psychoanalysis,1984
JULLPE,Philippe Julien,"La Psychanalyse Et le Religieux: Freud, Jung,Lacan",2008
HILLCA,Fiona Hile,Lady Chandos and the Humanity Function: Reading the Postscript to J. M. Coetzee?s Elizabeth Costello with Lacan and Badiou,2022
LACGLO,Jacques Lacan and Russell Grigg,Geneva Lecture on the Symptom,1989
NEWNRO-2,Saul Newman,New Reflections on the Theory of Power: A Lacanian Perspective,2004
MELPAT-8,Stephen Melville,"Psychoanalysis and the Place of ""Jouissance""",1987
SJHFVB,"Cecilia Sj\""{o}holm","Family Values: Butler, Lacan and the Rise of Antigone",2002
SAMLKA,Ruth Sample,"Lacan, Kant, and Sade",1995
CAMRSA-2,Byron A. Campbell and Doris Kraeling,Response Strength as a Function of Drive Level and Amount of Drive Reduction,1953
SHEAPO-2,Charles Shepherdson,A Pound of Flesh: Lacan's Reading of the Visible and the Invisible,1997
MUSPAO,O. Musubu,"Psychoanalysis and Ontology: Lacan, Heidegger and Merleau-Ponty",1998
BROTFO-3,Thomas Brockleman,The Failure of the Radical Democratic Imaginary: I Ek Versus Laclau and Mouffe on Vestigial Utopia,2003
VASTFB-2,Cathryn Vasseleu,The Face Before the Mirror-Stage,1991
MACTWB,David Macey,Thinking with Borrowed Concepts: Althusser and Lacan,1994
SAMBPA,Robert Samuels,Between Philosophy and Psychoanalysis: Lacan's Reconstruction of Freud,1994
KNOLRD,Denis Knoepfler,Les Relations des Cit\'{e}s Eub\'{e}ennes Avec Antigone Gonatas Et la Chronologie Delphique au D\'{e}but de l'\'{E}poque \'{E}tolienne,1995
SHAJL,Matthew Sharpe,Jacques Lacan,2002
DOLPAA-3,Frederick M. Dolan,Political Action and the Unconscious,1995
DEWIAT-3,Peters Dews,Imagination and the Symbolic:Castoriadis and Lacan,2002
DOLPAA-5,Frederick M. Dolan,Political Action and the Unconscious: Decentering the Subject in Arendt and Lacan,1995
LACTIN,Jacques Lacan,The Italian Note,2010
TOMTIO-2,Samo Tom\v{s}i\vc,The Invention of New Love in Psychoanalysis,2010
TUOAIT-3,Linartas Tuomas,Ambivalence in the Concept of Libidinal Economy: Jean-Fran\c{c}ois Lyotard Against Samo Tom\v{s}i\vc,2024
RAEQTP,Gavin Rae,Questioning the Phallus: Jacques Lacan and Judith Butler,2020
SHAPLA,Matthew J. Sharpe,Purloined Letters--Lacan Avec Strauss,2021
DOULSA,Douglas McConnell and Grant Gillett,"Lacan, Science and Determinism",2005
DOULFT,Douglas McConnell and Grant Gillett,Lacan for the Philosophical Psychiatrist,2005
TOMTNO,Samo Tom\v{s}i\vc,Three Notes on Science and Psychoanalysis,2012
TRURDC,Robert Trumbull,"Revisiting Derrida?s Critique of Lacan, Beyond the Misunderstandings",2022
GUIOED,Bruno De Almeida Guimar\~{a}es,O Estatuto Do Inconsciente \'E \'{E}tico,2007
BEATAP-7,Tina Beattie,Theology After Postmodernity: Divining the Void--a Lacanian Reading of Thomas Aquinas,2013
