ID,Author,Title,Year
FRIFAA-2,Stacie Friend,Fiction as a Genre,2012
NIGGID-2,Andrea Wilson Nightingale,Genres in Dialogue: Plato and the Construct of Philosophy,1995
ROWPAT,Christopher Rowe,Plato and the Art of Philosophical Writing,2007
MAIEFT-3,Emar Maier and Merel Semeijn,Extracting Fictional Truth From Unreliable Sources,2021
HERENW,David Herman and Richard J. Gerrig,Experiencing Narrative Worlds: On the Psychological Activities of Reading,1997
SKIRAR,Quentin Skinner,Reason and Rhetoric in the Philosophy of Hobbes,1996
FRIIUA-2,Stacie Friend,Fictive Utterance and Imagining Ii,2011
RYALTA-3,Michael Ryan and Terry Eagleton,Literary Theory: An Introduction,1984
MARFTD-13,Neri Marsili,Fictions That Don?T Tell the Truth,2024
VIETPA,Emanuel Viebahn,The Poet Affirmeth,manuscript
FRIFIF,Stacie Friend,Falsehoods in Film: Documentary Vs Fiction,2021
HERLTA-3,David Herman and Terry Eagleton,Literary Theory: An Introduction,1998
BARNAN-2,Rachel Barney,Names and Nature in Plato's Cratylus,2001
KIVTPO-5,Peter Kivy,The Performance of Reading: An Essay in the Philosophy of Literature,2006
WILSAT-29,Adam M. Willows,Stories and the Development of Virtue,2017
CARTRC-4,"No\""{e}l Carroll and John Gibson",The Routledge Companion to Philosophy of Literature,2015
GILFAA,Christopher Gill and Mary Margaret McCabe,Form and Argument in Late Plato,1996
ELDLAH-2,Richard Thomas Eldridge,"Leading a Human Life: Wittgenstein, Intentionality, and Romanticism",1997
TOGTSO-2,Neal A. Tognazzini,The Strains of Involvement,2015
HERLTA-4,David Herman and Jonathan Culler,Literary Theory: A Very Short Introduction,1999
HARTVO-25,James Harold,The Value of Fidelity in Adaptation,2018
PERWLP-2,Marjorie Perloff,Wittgenstein?s Ladder: Poetic Language and the Strangeness of the Ordinary,1996
SARWIL-9,Jean Paul Sartre,"""What is Literature?"" and Other Essays",1988
MERTTT,Thomas Cl\'{e}ment Mercier and Jacques Derrida and \'{E}velyne Grossman,"The Truth That Hurts, or the Corps \`A Corps of Tongues: An Interview with Jacques Derrida",2019
AGUVST,Jes\'{u}s Miguel Delgado Del Aguila,Violencia Social: Tem\'{a}tica Regularizada y Necesaria Para la Recepci\'{o}n de la Novela Policial Peruana (1990-2013),2023
VRATAD,Andreas Vrahimis,"The ""Analytic""/""Continental"" Divide and the Question of Philosophy's Relation to Literature",2019
Sharrock2016-MOYI-3,Dani\`{e}le Moyal{-}Sharrock,Introduction,2016
LANTAO-3,Berel Lang,The Anatomy of Philosophical Style: Literary Philosophy and the Philosophy of Literature,1990
AGUEAC-3,Jes\'{u}s Miguel Delgado Del Aguila,Entrevista a Cristhian Brice\~{n}o \'{A}ngeles Sobre Los Escritores y Las Editoriales,2023
KENBEC-2,Stuart Kendall and Leslie Hill,Blanchot: Extreme Contemporary,2000
JARBEC,Steven Jaron and Leslie Hill,Blanchot: Extreme Contemporary,1999
ADAAHA-3,Don Adams,Aristophanes's Hiccups and Erotic Impotence,2021
HMLSLS,"Nora H\""{a}m\""{a}l\""{a}inen",Sara Lidman's Secular Reading of Original Sin,2021
CAVTWL,Terence Cave,Thinking with Literature: Towards a Cognitive Criticism,2016
PRIPDI,Michael Prince,"Philosophical Dialogue in the British Enlightenment: Theology, Aesthetics and the Novel",1996
CHABAR,Marc Champagne and Mimi Reisel Gladstein,"Beauvoir and Rand: Asphyxiating People, Having Sex, and Pursuing a Career",2015
JOVKOP,Iris Vidmar Jovanovi\'c,Kant on Poetry and Cognition,2020
LYOBIE,John D. Lyons,Before Imagination: Embodied Thought From Montaigne to Rousseau,2005
SMIDAA,Robert Smith,Derrida and Autobiography,1995
HARMDM-9,Ann Hartle,Michel de Montaigne: Accidental Philosopher,2003
HAGOPA,Garry Hagberg,"On Philosophy as Therapy: Wittgenstein, Cavell, and Autobiographical Writing",2003
KAPAFT,Alice Y. Kaplan and Susan Rubin Suleiman,Authoritarian Fictions: The Ideological Novel as a Literary Genre,1985
LYODAM,John D. Lyons,Descartes and Modern Imagination,1999
GERRFA,Richard J. Gerrig,Reexperiencing Fiction and Non-Fiction,1989
HINVWA,Jaakko Hintikka,Virginia Woolf and Our Knowledge of the External World,1979
GONEHD,R. Gonz\'{a}lez,El Humanismo de Humberto S\'{a}bato: ?Visionario Del \'{U}ltimo Engranaje?,2012
MAGNCP-3,Bernd Magnus and Stanley Stewart and Jean{-}Pierre Mileur,Nietzsche's Case: Philosophy as/and Literature,1992
LANDFT,Joshua Landy,"Don't Feed the Liars! On Fraudulent Memoirs, and Why They're Bad",2022
AGUCTD-2,Jes\'{u}s Miguel Delgado Del Aguila,Construcci\'{o}n Te\'{o}rica Del Campo Figurativo Para El An\'{a}lisis L\'{i}rico (1st edition),2021
SOUEDW,Eraldo Souza dos Santos,Everything Disappears,manuscript
AGUEVE,Jes\'{u}s Miguel Delgado Del Aguila,Estratificaci\'{o}n Violenta En Los Personajes de la Ciudad y Los Perros,2021
OLEKAI,Ole Martin Skille\a{a}s,Knowledge and Imagination in Fiction and Autobiography,2006
VARNLB,Dimitris Vardoulakis,"Not Life, but Bad Literature",2013
AGUCVC,Jes\'{u}s Miguel Delgado Del Aguila,Construcci\'{o}n Viril Con la Experiencia Femenina En la Ciudad y Los Perros,2022
GARVLP,Manon Garcia,Vivre la Philosophie : Les M\'{e}moires Comme \O{E}uvre Philosophique,2018
AGUECS-3,Jes\'{u}s Miguel Delgado Del Aguila,Estudios Cr\'{i}ticos Sobre la Instrucci\'{o}n Militar En la Ciudad y Los Perros,2021
AGUEDL-3,Jes\'{u}s Miguel Delgado Del Aguila,Ense\~{n}anza de la Literatura Espa\~{n}ola En Contextos Universitarios Peruanos. Entrevista a Mar\'{i}a Luisa Roel Mendizabal,2022
RETMDW,John Rethorst,Moral Density: Why Teaching Art is Teaching Ethics,2019
FOLNNI,Christian Folde,Non-Fictional Narrators in Fictional Narratives,2017
JAMA-3,Henry James and Frederick W. Dupee,Autobiography,1957
DEBDTR,Paul Deb,?Did This Really Happen??: Amit Chaudhuri?s Acknowledgement of the Autobiographical,2022
AGUCHE-2,Jes\'{u}s Miguel Delgado Del Aguila,Correspondencia Humanista En El Discurso Ensay\'{i}stico Vargasllosiano Con la Ciudad y Los Perros,2021
AGUEAJ-2,Jes\'{u}s Miguel Delgado Del Aguila,"Entrevista a Jos\'e Manuel S\'{a}nchez Ron, Vicedirector de la Real Academia Espa\~{n}ola. B\'{u}squeda de M\'{e}todos de Investigaci\'{o}n de la Literatura En Conjunci\'{o}n Con la F\'{i}sica",2022
AGUDDL-2,Jes\'{u}s Miguel Delgado Del Aguila,Desarrollo de la Literatura Boliviana Contempor\'{a}nea: Entrevista a Blithz Lozada Pereira En Julio de 2021,2021
LANTAO-16,Joshua Landy,The Abyss of Freedom: Love and Legitimacy in Constant?s \emph{Adolphe},2009
MACDEN-2,Fernando Da Silva Machado,Diurno e Noturno No Pensamento de Gaston Bachelard,2016
HAGACT-2,Garry Hagberg and Walter Jost,A Companion to the Philosophy of Literature,2007
BELCAP-3,Michael Bell,Creativity and Pedagogy in Leavis,2016
STAAPA-3,Paul Standish,Absolute Pitch and Exquisite Rightness of Tone,2016
GIBSOS,John Gibson,Selves on Selves: The Philosophical Significance of Autobiography,2012
DIBNAE,E. Di Bona,Narrative and Essayistic Temporalities,2015
CASILS-2,Marco Castagna,Il Lettore Sedotto o Della Circolarit\`a Ermeneutica di Retorica Ed Estetica,2003
MCDWAC-2,Richard McDonough,Wittgenstein's Augustinian Cosmogony in Zettel 608,2015
ZARTCV,Aleks Zarnitsyn,The Cognitive Value of Fiction in Thought Experiments in Personal Identity,2015
BLAOPS,Brand Blanshard,On Philosophical Style,1969
MASPRT-3,Jeff Mason,Philosophical Rhetoric: The Function of Indirection in Philosophical Writing,1989
RIBMOW,Brian Ribeiro,Montaigne on Witches and the Authority of Religion in the Public Sphere,2009
CALMAT-5,Alison Calhoun,Montaigne and the Comic: Exposing Private Life,2011
PALSAP-5,Anthony Palmer and T. S. Champlin,Self-Deception: A Problem About Autobiography,1979
LAMFAR,Peter Lamarque,Fiction and Reality,1983
POSNAN,Richard A. Posner,Narrative and Narratology in Classroom and Courtroom,1997
SCHFPM-2,Stephen Adam Schwartz,Faux Pas: Maurice Blanchot on the Ontology of Literature,1998
FENFRO,Gene Fendt,Five Readings of Euthyphro,2014
MONTFL,Ray Monk,"This Fictitious Life: Virginia Woolf on Biography, Reality, and Character",2007
EDEMMO,Christopher Edelman,Montaigne's Moral Objectivism,2011
BYUPAI,Steinar B\o{}yum,Philosophical Allegories in Rousseau,2007
GOOIHA,Eugene Goodheart,Is History a Science?,2005
JOHTPO-75,Eileen John and Dominic McIver Lopes,The Philosophy of Literature: Contemporary and Classic Readings - an Anthology,2004
LIGTSI,C. R. Ligota,'This Story is Not True.' Fact and Fiction in Antiquity,1982
NANAPO-5,Ted Nannicelli,A Philosophy of the Screenplay,2012
COWIIA,Christopher Cowley,Ivan Ilych and Autobiographical Despair,2021
MORNPO-4,Nicholas D. More,The Philosophy of Decadence,2019
LESOEC,James Lesher,"Odysse\'{a}s Elytis's Conversation with Heraclitus: ""Of Ephesus""",2020
ENGQIA,Patrik Engisch,"""Fiction, Imagination, and Narrative""",2022
FULWFT-2,Joseph S. Fulda,Written for the Moment,2012
COLPAA-13,Vincent M. Colapietro,Peirce as a Writer,2019
MCGNT,Rafe McGregor,Narrative Thickness,2015
BATCRE,Doug Battersby,"Close Reading, Epistemology, and Affect: Nabokov After Rorty",2020
SAILCA,Edward W. Said,Literary Criticism and Politics?,2020
HULTOM,Michaela Hulstyn,Theory of Mind and Experimental Autobiography: Alain Robbe-Grillet and Assia Djebar,2021
GLACCA-9,Roy Glassberg,Charlie Chaplin and Aristotle: The Mechanics of Ending City Lights,2020
JUNKTE,Nathan A. Jung,Know Thyself: Emerson's Pedagogy of Recollection,2020
HARSWM,Ann Hartle,"""Sociable Wisdom"": Montaigne's Transformation of Philosophy",2015
SHESBL,Dina Sherzer,"Samuel Beckett, Linguist and Poetician: A View From ""the Unnamable""",1988
FULTEO-5,Joseph Fulda,The Ethics of Pseudonymous Publication,2007
QUILOG-2,David Quint,"Letting Oneself Go: ""De la Colere"" and Montaigne's Ethical Reflections",2000
SAUPAG-2,Nicholas Saul,"Philosophy and German Literature, 1700?1990",2002
MACTLO-23,Brian Macaskill,"The Logic of Coprophilia: Mathematics and Beckett's ""Molloy""",1988
BALLN,Baldwin,Literary Note,1911
GIRVIB,Ren\'e Girard,Violence in Biblical Narrative,1999
RUDILI,Hans H. Rudnick,Is Life in Literature a Fiction?,1990
CAMMAT-7,E. Campion,Montaigne and the Quality of Mercy: Ethical and Political Themes in the Essais. By David Quint,1999
LINSFT-3,James Lindsay,Selections From the Literature of Theismalfred Caldecott,1905
SWELFO,Eileen Sweeney,Literary Forms of Medieval Philosophy,2008
EAGMAM-3,Terry Eagleton,Macherey and Marxist Literary Theory,1982
NIEAES-2,Edmund Nierlich,An ?Empirical Science? of Literature,2005
BROMPP,Jules Brody,"Montaigne: Philosophy, Philology, Literature",1998
HENGTM,Patrick Gerard Henry,Getting the Message in Montaigne's,2000
MEYLTI,Hugo Meynell,Literary Theory -- What is to Be Done?,1996
ACHWAS-2,James Acheson,Woolf and Schopenhauer: Artistic Theory and Practice,2019
WOOMAT-3,Michael Wood,Montaigne and the Mirror of Example,1989
BAYFAA-2,Nina Baym,Feminism and American Literary History: Essays,1992
HARMAM-3,Ann Hartle,Montaigne's Accidental Moral Philosophy,2000
COLLFA,Alan Collett,"Literature, Fiction and Autobiography",1989
WALTRO-8,Peter Walmsley,The Rhetoric of Berkeley's Philosophy,1990
FRERAT-9,Erich Freiberger,Reason as the Death of Fathers: Plato's Sophist and the Ghost's Command in Hamlet,2020
SANEAT-11,Dennis L. Sansom,"Ethics and the Experience of Death: Some Lessons From Sophocles, Shakespeare, and Donne",2010
ROBLAT,Kevin Robb,Language and Thought in Early Greek Philosophy,1983
BURHIA,E. S. Burt,Hospitality in Autobiography : Levinas Chez de Quincey,2009
LEVPAT-8,Don Levi,Philosophy and the Bible: The Case of Open Theism,2014
HENMAT-4,Patrick Patrick Gerard Henry,Montaigne and the Quality of Mercy: Ethical and Political Themes in the Essais (Review),1998
STOTMO-16,Greg Stone,The Myth of Narcissus as a Surreptitious Allegory About Creativity,2016
MUEPOL,V. C. A.,Philosophy of Literature,1949
ZIONAT,Theodore Ziolkowski,Nietzsche Among the Novelists,2018
BLCP,E. N. B. and Allan H. Gilbert and Gay W. Allen and Harry H. Clark,Literary Criticism: Plato to Drydenliterary Criticism: Pope to Croce,1942
SIMSOL,Stuart Sim,State of Literary Theory,1983
CRYTLR,Daisy Crystal and Andreas Tietze,Turkish Literary Reader,1967
WILLAM-5,Norman Wilde,Law and Morals. Roscoe Pound,1925
JOYRL,Chris Joyce,Rethinking Leavis,2016
HAGDSA,Garry Hagberg,"Davidson, Self-Knowledge, and Autobiographical Writing",2002
VIDAHG-2,Iris Vidmar,"Alan H. Goldman, Philosophy and the Novel",2015
FISEAL-3,David Fishelov,Evolution and Literary Studies: Time to Evolve,2017
PETAWP-3,Michael Peters,"Academic Writing, Philosophy and Genre",2009
BALTAP-4,Edward G. Ballard,Toward a Philosophy for Literature,1952
RUSMER,G. H. Russell and G. C. Kratzmann and James Simpson,"Corneille, Classicism, and the Ruses of Symmetry",1986
Arlyck1989-CARAAE-6,Elisabeth Cardonne{-}Arlyck and Steven Vogel,Autobiography as Enigma,1989
LLOTSA-2,Genevieve Lloyd,The Self as Fiction: Philosophy and Autobiography,1986
HEWGIT,Lead D. Hewitt,Getting Into the (Speech) Act: Autobiography as Theory and Performance,1987
SZAAAW,B\'{e}la Szabados,Autobiography After Wittgenstein,1992
HENGTM-2,Patrick Gerard Henry,Getting the Message in Montaigne's Essays,2000
DEJSAT,Maryann de Julio and Renee Riese Hubert,Surrealism and the Book,1989
YAREIM-3,Victor S. Yarros,Ethics in Modern Fiction,1918
GASTLE,Jake Gaskins,The Literary Essay and the Esl Student: A Case Study,2015
BEAAAT,R. W. Beardsmore,Autobiography and the Brain: Mary Warnock on Memory,1989
KAWVMA,Robert S. Kawashima,Verbal Medium and Narrative Art in Homer and the Bible,2004
SELR-8,E. H. S. and Ants Oras,Estonian Literary Reader,1964
GORTPO-35,Daniel Gordon,"""The Politics of the Classroom Are Not the Politics of the World"": An Unpublished Speech by Edward W. Said",2020
HOASI,Terence Allan Hoagwood,Skepticism \& Ideology: Shelley's Political Prose and its Philosophical Context From Bacon to Marx,1988
TURGN,James Turner,"6. ?Genuinely National Poetry and Prose?: Literary Philology and Literary Studies, 1800?1860",2014
FARLAM,James T. Farrel,Literature and Morality,1948
PAYKA,F. Anne Payne,King Alfred \& Boethius: An Analysis of the Old English Version of the Consolation of Philosophy,1968
ARAOPD-3,Sergio Xavier Gomes de Araujo,O Problema Do Ethos da Escrita de Si Em Montaigne e Em Petrarca: Do Ensaio \`A Ep\'{i}stola,2012
ROBLT,Ian Robinson,Leavisian Thinking,2016
HERAAA,David Herman,"Autobiography, Allegory, and the Construction of Self",1995
SUPMCR,James J. Supple,Montaigne's Career (Review),2000
DUBTGO-2,James Duban,"The Generalization of Holocaust Denial: Meyer Levin, William James, and the Broadway Production of the Diary of Anne Frank",2015
BOETCO-2,Boethius and Noel Harold Kaylor and Philip Edward Phillips,"The Consolation of Queen Elizabeth I: The Queen's Translation of Boethius's de Consolatione Philosophiae: Public Record Office, Manuscript Sp 12/289",2009
LACTAO-6,Michael Lackey,"The Art of ""Reading-to"" and the Post-Holocaust Suicide in Schlink's the Reader",2018
MCK_IM-2,Mary B. McKinley,\emph{Montaigne in Motion} (Review),1987
RAYRPT,William Ray and Donald Rice and Peter Schofer,Rhetorical Poetics: Theory and Practice of Figural and Symbolic Reading in Modern French Literature,1986
SCHPOL-13,Severin Schroeder,Philosophy of Literature,2010
CHRPEH,Jerome Christensen,Practicing Enlightenment: Hume and the Formation of a Literary Career,1987
FISWAM-3,Michael Fischer,Wittgenstein and Modernism,1986
PETPGA,Michael A. Peters,"Philosophy, Genre, and Academic Writing",2009
RUTFOM,Jennifer Ruth,"Flannery O'connor's Mrs. Turpin, Hannah Arendt's Adolf Eichmann, and Dreams of Boxcars",2018
CARAHT-2,James D. Carney,A Historical Theory of Art Criticism,1994
HICPL-3,G. Dawes Hicks,Philosophical Literature,1929
Turner2015-TALMOE,Zeynep Talay{-}Turner,Musil on Ethics and Aesthetics: Essayism as a Way of Living,2015
CoopeyManuscript-EDMAAA-2,Jack Robert June Edmunds{-}Coopey,Literature as Negative Theology: The Literary Absolute (1988) and Jean-Luc Nancy's Philosophical Method,manuscript
HENHIS,Patrick Henry,Home is Somewhere Else: Autobiography in Two Voices (Review),1995
AGNPAT,Barbara Agnese and Claire{-}Anne Gormally,Philosophy as Translation,2015
ZAHMDM,Zahi Anbra Zalloua,Michel de Montaigne: Accidental Philosopher (Review),2004
HARRD-3,P. A. Harris and C. Larsonneur,Revisiting Dejima : From Recollections to Fiction in David Mitchell?s the Thousand Autumns of Jacob de Zoet,2015
MARNDO,Sky Marsen,"Narrative Dimensions of Philosophy: A Semiotic Exploration in the Work of Merleau-Ponty, Kierkegaard and Austin",2006
WAT_NA-2,Julia Watson,"\emph{The New Art of Autobiography: An Essay on the ""Life of Giambattista Vico Written by Himself,""} (Review)",1993
GREBSA-2,John Gregg,Blanchot's Suicidal Artist: Writing and the (Im)Possibility of Death,1988
HOLRAN-3,Denis Hollier and Richard Joseph Golsan and Ruth Larson,Revisiting a New History of French Literature,2003
PEPAOA,Stephen C. Pepper,Autobiography of an Aesthetics,1970
BAIAA-3,Alexander Bain,An Autobiography,1905
BOYTLM,Percy H. Boynton,The Literary Mind. Max Eastman,1933
DARLEA,Tim Dare,"Lawyers, Ethics, And",2001
WILWAW,"Mari\""{e}tte Willemsen",Welcoming (Auto)Biography Without Waving Away Fiction,2006
GALTIW-4,Mattia Gallotti and Raphael Lyne,The Individual ?We? Narrator,2019
SCHREG,Marilyn Schwartz,Review Essay: Guidelines for Bias-Free Writing,1996
HUSQCL,S. Muzaffar Husain,"Quran's Cultural, Literary, and Philosophical Perspectives",1980
CARDCV,Noel Carroll,Danto's Comic Vision: Philosophical Method and Literary Style,2015
HILHEF,Richard Hillyer,Hobbes's Explicated Fables and the Legacy of the Ancients,2004
TEEIEE,Rudolphus Teeuwen,Incomplete Enlightenment: Edgar Reitz's the End of the Future and the Aesthetics of Suffering,2020
HENMAT,Patrick Gerard Henry,Montaigne and the Quality of Mercy: Ethical and Political Themes in the Essais (Review),1998
DELMAM,Ann T. Delehanty,Morality and Method in Pascal's,2004
BENTEI-3,James R. Bennett,The Essay in Recent Anthologies of Literary Criticism,1989
KINBVS-3,J. Kindon,Byron Versus Spenser,1904
HARRRA-3,W. John Harker,Reader Response and the Act of Reading: Seven Studies in Review,1994
SHALMF,Brian W. Shaffer and William Ray and Robert C. Holub,Literary Meaning From Phenomenology to Deconstructionreception Theory: A Critical Introduction,1987
CRACAC-5,R. S. Crane and W. R. Keast and Richard Mckeon and Norman Maclean and Elder Olson,Critics and Criticism: Ancient and Modern,1953
WELTOL-2,Ren\'e Wellek and Austin Warren,Theory of Literature [by] Ren\'e Wellek and Austin Warren,1954
GRESTI-3,Robert W. Greene and Mary Lydon,Skirting the Issue: Essays in Literary Theory,1997
CHAIPA-2,William Charlton,Is Philosophy a Form of Literature?,1974
FEROTP-2,Maurizio Ferraris,Otherness: The Prevalence of the Real,2014
BAKWDW-2,Robert Baker,What Do We Mean When We Talk About Transcendence? Plato and Virginia Woolf,2019
LINLE,James Lindsay,Literary Essays,1912
SURDAM,Leon Surette,Deconstruction: A Misprision of Saussure and Charles Sanders Peirce,2019
DURWPO,Jane Duran,"Women Philosophers of the Seventeenth Century,",2007
NEA_AM-3,Lisa Neal,\emph{Travel as Metaphor: From Montaigne to Rousseau} (Review),1993
REG_A_-4,Richard L. Regosin,"\emph{Montaigne}, And: \emph{Distinguo: Reading Montaigne Differently}, And: \emph{The Discipline of Subjectivity: An Essay on Montaigne}, And: \emph{The Political Philosophy of Montaigne} (Review)",1992
HENFTP,Patrick Gerard Henry,From the Perspective of the Self: Montaigne's Self-Portrait.(Review),1995
DEALOT,Paul Dean,Leavis on Tragedy,2016
WOOAIW,Paul Woodruff,"""... Merely a Man of Letters"": An Interview with Jorge Luis Borges",1977
BAU_MA-2,Cathleen M. Bauschatz,\emph{Essaying Montaigne: A Study of the Renaissance Institution of Writing and Reading} (Review),1984
KALTEO-10,Horace Meyer Kallen,The Essence of Tragedy,1912
HARLAW-2,Bernard Harrison,Leavis and Wittgenstein,2016
SCHROM-2,Jerome Schwartz,Reflections on Montaigne's Ethical Thinking,2000
WALALA-2,William Walsh,Autobiographical Literature and Educational Thought,1959
FRABAB-6,Hilary Fraser,Beauty and Belief: Aesthetics and Religion in Victorian Literature,1986
TIFPTT,Daniel Tiffany,Phantom Transmissions: The Radio Broadcasts of Ezra Pound,1990
OLITCA-2,Oliver Conolly and Bashshar Haydar,The Case Against Faction,2008
ALBTMO-6,Ernest Albee,The Meaning of Literature for Philosophy,1909
RITEOL,David G. Ritchie,Essays on Literature and Philosophy.Edward Caird,1893
BUDTFO,Sanford Budick,The Function of Kant's Miltonic Citations on a Page of the Opus Postumum,2016
LEVEII-8,Ronald B. Levinson,Ethical Inwardness in Greek Tragedy,1926
HENMAT-3,Patrick Gerard Henry,"Montaigne Among the Moderns: Receptions of the"" Essais""(Review)",1995
SARWIL-8,Jean Paul Sartre,What is Literature?,1949
LUKDSU,"Gy\""{o}rgy Luk\'{a}cs",Die Seele Und Die Formen Essays,1911
RIBGCO-2,Neil M. Ribe,Goethe's Critique of Newton: A Reconsideration,1984
GILA-6,Eric Gill,Autobiography,1942
LEVRAR-2,George Levine,Realism and Representation,1993
CHALSA-5,Seymour Chatman,Literary Style: A Symposium,1974
BROSO-3,Virgil W. Brower,"Speech \& Oral Phenomena: Memory, Mouth, Writing, Life-Death",2011
PICBRD,Pierre Pica,Bibiographie R\'{e}sum\'{e}e des Travaux de Mitsou Ronat,1986
CRALRA-2,Betty Jean Craige,Literary Relativity: An Essay on Twentieth-Century Narrative,1982
WHAISI,William Whallon,"Inconsistencies: Studies in the New Testament, the Inferno, Othello, and Beowulf",1983
FIEFRT-2,Frederick Vanderbilt Field,From Right to Left: An Autobiography,1984
LYDSTI,Mary Lydon,Skirting the Issue: Essays in Literary Theory,1995
GHIIDM,Enrico Ghidetti,Il Decadentismo: Materiali e Testimonianze Critiche,1984
Bear1994-DREPFO,Annette Drew{-}Bear,Painted Faces on the Renaissance Stage: The Moral Significance of Face-Painting Conventions,1994
KOPLAL,Martin \v{S}kop,Law and Literature ? a Meaningful Connection,2015
RAMAIA-6,Venkat Ramanan,Aesthetic Ineffability and the Rebirth of the Reader,2020
CHOIOA,Wojciech D. Chojna,Identity of a Literary Work of Art,1992
HORLAT-3,Lewis Horrox,Literature and the War,1939
RGIPDD,Jos\'e R\'{e}gio and Jo\~{a}o Gaspar Sim\~{o}es,"P\'{a}ginas de Doutrina e Cr\'{i}tica da ""Presen\c{c}a""",1977
MITPAL,"Giedr\""e \D{H}mitien\""e",Perception and Literary Style,2005
WANOGA,Michelene Wandor,On Gender and Writing,1983
POWTHI,Meredith A. Powers,The Heroine in Western Literature: The Archetype and Her Reemergence in Modern Prose,2000
SARLE-3,Jean Paul Sartre,Literature \& Existentialism,2021
BUSOMA,Luiz Busatto,O Modernismo Antropof'agico No Esp'irito Santo,1992
MUSRNC,Carlo Muscetta,"Realismo, Neorealismo, Controrealismo",1990
HAWUTT,Jeremy Hawthorn,Unlocking the Text: Fundamental Issues in Literary Theory,1987
GLAKEY,"Yal\c{c}i{}n G\""{u}lay","Kami?l Erdem \""{O}yk\""{u}leri?nde Meti?nler Arasilik",2024
LUIRJR,"A. L. Luigas and Tartu Riiklik \""{U}likool",Realismi Ja Romantismi Probleeme Inglise Ja Ameerika Kirjanduses Xix Ja Xx Sajandil = Problemy Realizma I Romantizma V Angliiskoi I Amerikanskoi Literature Xix I Xx Vv,1979
BROTIM-10,Virgil W. Brower,The Immersion Method Ii (Logic \& Malcolm X),2012
LAUER-2,"Reinhard Lauer and Dietrich Briesemeister and Klaus P\""{o}rtl and Peter Gerlinghoff and Witold Ko\'{s}ny and Fritz Martini and Reinder P. Meijer and Mogens Br\o{}ndsted and Theodor Wolpers and Klaus Heitmann",Neues Handbuch der Literaturwissenschaft,1972
SRITMM,Michael Srigley,The Mighty Maze: A Study of Pope's an Essay on Man,1994
GENFED-2,G\'{e}rard Genette,Fiction Et Diction: Pr\'{e}c\'{e}d\'e de Introduction \`A L'Architexte,1991
SEMS-2,Rostislav Ivanovich Sementkovskii,Sochineniia,1906
DUNDDA,Irma Duncan,Duncan Dancer: An Autobiography,1966
HEDLTS,Elaine Hedges and Shelley Fisher Fishkin,Listening to Silences: New Essays in Feminist Criticism,1994
MEHOLU,"P\""{a}ivi Mehtonen","Obscure Language, Unclear Literature: Theory and Practice From Quintilian to the Enlightenment",2003
REGHFM,Richard L. Regosin,"Hugo Friedrich's ""Montaigne""",1992
HALRLC-2,Vernon Hall and Trusten Wheeler Russell,Renaissance Literary Criticism,1946
CLATMA-12,Ira Clark,The Moral Art of Philip Massinger,1993
GOETCO-2,Mary Paul Goetz,The Concept of Nobility in German Didactic Literature of the Thirteenth Century,2013
GENFV,G\'{e}rard Genette,Figures V,1966
ZAMASH,"Evgeni\a{e}i Ivanovich Zam\""{e}i\`{i}atin and Mirra Ginsburg",A Soviet Heretic: Essays,1992
BRINIA,Patrick Bridgwater,Nietzsche in Anglosaxony: A Study of Nietzsche's Impact on English and American Literature,1972
GANTVO-2,Keith Gandal,"The Virtues of the Vicious: Jacob Riis, Stephen Crane, and the Spectacle of the Slum",1997
PIPRDI,William Bowman Piper,Reconcilable Differences in Eighteenth-Century English Literature,1999
STELAS-2,George Steiner,Language and Silence: Essays 1958-1966,1969
DELLID-16,Jes\'{u}s Miguel Delgado Del Aguila,?La Incompatibilidad de la Poes\'{i}a Con El Logos? (Rese\~{n}a),forthcoming
VANDSN,Carlos Vanegas,"Del Ser Nacional y Otras Ficciones. A Prop\'{o}sito de Efr\'{e}n Giraldo, Negroides, Simuladores, Melanc\'{o}licos. El Ser Nacional En El Ensayo Literario Colombiano Del Siglo Xx",2013
COLAAB-4,R. G. Collingwood,An Autobiography. By Howard Hannay,1940
MADWAN-2,Patrick Madigan,"Women and National Socialism in Postwar German Literature: Gender, Memory, and Subjectivity. By Katherinestone. Pp. 232, Rochester, Ny, Camden House, 2017, \$65.00",2020
HOPBIH,E. W. Hopkins,Review of : \emph{Buddhism: Its History and Literature.},1896
SEAHRP-2,Roger Seamon,"H.P. Rickman, Philosophy in Literature",1998
MARBRM,Dudley M. Marchi,"Book Review: Montaigne Among the Moderns: Receptions of the ""Essais""",1995
APOL-3,V. C. A.,Philosophy of Literature,1951
MADLTC,Patrick Madigan,"Leo Tolstoy (Critical Lives). By Andreizorin. Pp. 219. London: Reaktion Books, 2020, \pounds11.99",2020
SKIBRR,Quentin Skinner,Book Review: Reason and Rhetoric in the Philosophy of Hobbes,1997
DADWRP,E. M. Dadlez,"Waxler, Robert P. The Risk of Reading: How Literature Helps Us to Understand Ourselves and the World. New York: Bloomsbury, 2014, Vii + 191 Pp., \$77.00 Cloth",2016
FURBRH,Desider Furst and Lilian R. Furst,Book Review: Home is Somewhere Else: Autobiography in Two Voices,1995
NOULP,Emilie Noulet,Literary Problems,1956
