ID,Author,Title,Year
MATCAW,Erich Hatala Matthes,Cultural Appropriation Without Cultural Essentialism?,2016
XHIDDA,Michel{-}Antoine Xhignesse,Distant Dinosaurs and the Aesthetics of Remote Art,2024
DIXLIA-2,Daisy Dixon,Lies in Art,2022
PANMIT-2,Erwin Panofsky,Meaning in the Visual Arts: Papers in and on Art History,1955
DESACA-2,Johan de Smedt and Helen de Cruz,A Cognitive Approach to the Earliest Art,2011
RIGUTS-2,Nick Riggle,Using the Street for Art: A Reply to Baldini,2016
HOPRIF,Robert Hopkins,Realism in Film (and Other Representations),2016
AWEWEA,A. W. Eaton,Where Ethics and Aesthetics Meet: Titian's \emph{Rape of Europa},2003
BALSAA-2,Andrea Baldini,Street Art: A Reply to Riggle,2016
FASNCO,Hannah Fasnacht,The Narrative Characteristics of Images,2023
GODOTN-2,David Godden,On the Norms of Visual Argument: A Case for Normative Non-Revisionism,2017
LIUPOM-3,Michelle Liu,Paintings of Music,2022
RADMTM,Marietta Radomska,"Mourning the More-Than-Human: Somatechnics of Environmental Violence, Ethical Imaginaries, and Arts of Eco-Grief",2024
MAEAAP-6,Hans Maes and Jerrold Levinson,Art and Pornography: Philosophical Essays,2012
PETDTO-2,Mikael Pettersson,Depictive Traces: On the Phenomenology of Photography,2011
STEMOO-4,Jakub Stejskal,Monumental Origins of Art History: Lessons From Mesopotamia,forthcoming
MATPOT-17,Erich Hatala Matthes,Portraits of the Landscape,2019
STETSP-5,Jakub Stejskal,The Substitution Principle Revisited,2018
MORSAB-6,Iwan Morus,Seeing and Believing Science,2006
DAVVI-2,David Davies,Varying Impressions,2015
CROPOT-7,Paul Crowther,Phenomenology of the Visual Arts (Even the Frame),2009
BANPPA-2,Katerina Bantinaki,Pictorial Perception as Twofold Experience,2010
ABEPAA-2,Catharine Abell,Printmaking as an Art,2015
ALLPAA-7,Emmanuel Alloa,Performing an Appearance. On the Performativity of Images,2023
RAVCAA,Matteo Ravasio and Jiachen Liu and Ye Zhu,Calligraphy as a Symbol System,forthcoming
MORHMI-2,Chris Mortensen and Steve Leishman and Peter Quigley and Theresa Helke,How Many Impossible Images Did Escher Produce?,2013
ELPIIN,Andreas Elpidorou,Imagination in Non-Representational Painting,2010
CORLR-4,Andrew J. Corsa,"Labeouf, R\""{o}nkk\""o \& Turner, Digital Remix, and Group Authorship",2020
CARMTT,Paul Carter,Material Thinking: The Theory and Practice of Creative Research,2004
JARPSA,Ian Jarvie,Pornography Stumps Analytic Philosophers of Art,2015
ALLITA-3,Emmanuel Alloa,Iconic Turn: A Plea for Three Turns of the Screw,2015
ELPSTI,Andreas Elpidorou,Seeing the Impossible,2016
AVITOI,Doron Avital and Karolina Dolanska,The Original in the Digital Age,2023
SIMAPA-8,Vid Simoniti,Adrian Piper and the Rhetoric of Conceptual Art,2018
TURCCL,Matthew Turner,Classical Chinese Landscape Painting and the Aesthetic Appreciation of Nature,2009
BATERI,M. Pabst Battin,Exact Replication in the Visual Arts,1979
DALMAI,Anya Daly,Merleau-Ponty?s Aesthetic Interworld,2018
STEPAI-11,Jakub Stejskal,Postformalism: An Introduction,2022
WILSUE,M. Blake Wilson,Slicing Up Eyeballs: The Criminal Underworlds of Nicolas Winding Refn,2020
LENADL,Malena Le\'{o}n,Actitud de la Obra de Arte,2021
VANPGY,Carlos Vanegas,"Paul Gauguin y Mario Vargas Llosa, Entre El Arte y la Literatura. Manao Tupapau-El Esp\'{i}ritu Del Muerto la Recuerda, 1892",2015
TRICKA,Ioannis Trisokkas,Can Kant?s Aesthetics Accommodate Conceptual Art? A Reply to Costello,2020
STEAVE-2,Jakub Stejskal,Art's Visual Efficacy: The Case of Anthony Forge's Abelam Corpus,2016/2017
GILPIC,Daniel Gilman,Pictures in Cognition,1994
GRAVAT-2,Gordon Graham,Value and the Visual Arts,1994
GITWAS,Chrysoula Gitsoulis,Wittgenstein and Surrealism,2012
POPFAA,Maria Popczyk,Fear and Anxiety in the Dimensions of Art,2012
SPATEI,Rosanna Sparacino,The Ethical Implications of the Intentional Fallacy: How We Ought to Address the Art of Immoral Artists,2019
STEDTL,Marilyn Stendera,Disintegrating the Linear: Time in Simon Finn?s \emph{Instability},2018
ELETCB,Fell Elena and Ioanna Kopsiafti,"The Cognitive Basis of Aesthetics: Cassirer, Crowther, and the Future",2016
DEBWIA-2,Ulrich De Balbian,"What is Art (Classificatory Disputes, Aesthetic Judgements, Contemporary Art",2017
KEEQTS,Gavin Keeney,"""Shadow-Lands"": The Suffering Image",manuscript
VANALF-2,Carlos Vanegas and Javier Dom\'{i}nguez and Carlos Arturo Fern\'{a}ndez and Daniel Tob\'{o}n,Ante la Fragilidad de la Memoria,2014
PLUCOC,Gilbert Plumer,"Commentary On: Chiara Pollaroli's ""T(R)Opical Patterns in Advertising""",2013
HORWSI-2,Gizela Horvath,Whose Shoes? Identity in Works of Art,2011
GREARP,Michael Grenfell,Art Rules: Pierre Bourdieu and the Visual Arts,2007
ALLWIE-2,Emmanuel Alloa,Wann Ist Ein Bild? Bildwissenschaft Als Symptomatologie,2020
VANGLH,Carlos Vanegas,Gombrich: La Historia Del Arte y Las Humanidades,2016
CPI,Hans Maes,Challenging Partial Intentionalism,2008
DORMMP-2,Andreas Dorschel,Metaphysisch Malen: Philosophie Und Bild Bei Giorgio de Chirico,2009
DZAAAB,Davor Dzalto,Art: A Brief History of Absence,2015
JAKITT-4,Marzenna Jakubczak,"Introduction to the Issue: Psychophysical Integrity of the Human Self. Comparative Approach: Philosophy, Literature and Art",2015
SHATQO-3,S. Shafi,The Queerness of Art and the Foucauldian Origins of Judith Butler's Notion of Performativity; an Overview,2024
VANYBY,Carlos Vanegas,Yosman Botero y Postcolombino,2016
KEEVA,Gavin Keeney,Vertiginous Acedie,manuscript
SALSEI-2,Francisco Salinas,Sublimidad e Imaginaci\'{o}n En El Combate Tierra-Mundo: Una Lectura Existencialista de la Desgarradura Del Arte En Heidegger,2014
SNYDNP,Stephen Snyder,Danto's Narrative Philosophy of History and the End of Art,2015
ALLLDM-3,Emmanuel Alloa,L?Arr\^{e}t de Mort. Notes Sur le Temps Photographique,2022
DILPOM,John Dilworth,Pictorial Orientation Matters,2003
GOVAAM-2,K. E. Gover,Are All Multiples the Same? The Problematic Nature of the Limited Edition,2015
JAKASB,Marzenna Jakubczak,Architektura Stupy Buddyjskiej Jako Przyk\l{}ad Projektu Sakralnego,1999
CORPUE,Jos\'e Ram\'{o}n Fabelo Corzo,Por Una Est\'{e}tica Apegada a la Vida,2010
ALLALB,Emmanuel Alloa,A Lesser Being. From Louis Marin to Simondon and Back,2021
SEDCNA,Sonia Sedivy,Conventional Naturalism: A Perceptualist Account of Pictorial Representation,1996
GILLAE,Scott F. Gilbert and Marion Faber,Looking at Embryos: The Visual and Conceptual Aesthetics of Emerging Form,1996
Johnson2023-CANCSA-7,Logan Canada{-}Johnson,Cinematic Street Art? Exploring the Limits of the Philosophy of Street Art (1st edition),2023
WINSEM-2,David Winfield,Some Early Medieval Figure Sculpture From North-East Turkey,1968
DELAPO,Sophia Delza,A Picture of the Art of Face Painting and Make-Up in the Classical Chinese Theatre,1971
SANECF-3,Simone Santamato,"E Che Fa, Essere Confusi? \emph{8 1/2} di Federico Fellini",manuscript
STONWI,Kathleen Stock and Katherine Thomson{-}Jones,New Waves in Aesthetics,2008
WALSAT-23,Kendall Walton,Style and the Processes of Art,1979
ALLTDO-26,Derek Allan,The Death of Beauty: Goya's Etchings and Black Paintings Through the Eyes of Andr\'e Malraux,2016
ZISAAA,Jens Dam Ziska,Art as Alchemy: The Bildobjekt Interpretation of Pictorial Illusion,2018
DCBTCO,Dami\'{a}n Carl\'{o}s Bay\'{o}n,The Characteristics of the Visual Arts in America,1963
SAUJAQ,Martina Sauer,"Josef Albers. ""so Ist Kunst ... Erlebnis"" (1st edition)",2018
RONTMC,David Rondel,The Moral Consequences of the End of Art,2014
FAWCTT-4,Don Fawkes,Critically Thinking Through Visual Arts,2003
UTIGSU,Emil Utitz,Georg Simmel Und Die Philosophie der Kunst,1920
Smith1971-LUCPOT,Edward Lucie{-}Smith,Problems of the Working Critic of the Modern Visual Arts,1971
KLEIAT,Peter K. Klein,Insanity and the Sublime: Aesthetics and Theories of Mental Illness in Goya's Yard with Lunatics and Related Works,1998
CARIDO-8,Curtis Carter,Industrial Design: On its Characteristics and Relationships to the Visual Fine Arts,1981
FOKPAA,Simon Fokt,Pornographic Art and the Aesthetics of Pornography,2016
RYAAE,Leslie Ryan,Art + Ecology,2007
TONERI,Paul K. K. Tong,Exact Replication in the Visual Arts,1983
RAYTAP,Dominique Raynaud,"La Perspective A\'{e}rienne de L\'{e}onard de Vinci Et Ses Origines Dans l'Optique d'Ibn Al-Haytham (de Aspectibus, Iii, 7)",2009
ALLAMH,Derek Allan,Andr\'e Malraux,2014
STEDOT,Wolfgang Stechow,Definitions of the Baroque in the Visual Arts,1946
SLOTTO,Joseph C. Sloane,The Tradition of Figure Painting and Concepts of Modern Art in France From 1845 to 1870,1948
CALRP-3,Elisa Caldarola,Rappresentazione Pittorica,2015
MOSSIA,Daniel Moseley,"Self-Creation, Identity and Authenticity: A Study of ""a History of Violence"" and ""Eastern Promises""",2012
FEAAHE,Susan L. Feagin,"Andrew Harrison, Ed., Philosophy and the Visual Arts: Seeing and Abstracting Reviewed By",1988
HORICI,Gizela Horvath,\v{C}ije Cipele? Identitet U Umjetni\v{c}kim Djelima,2011
KRUABO,Linda Krumholz and Estella Lauter,Annotated Bibliography on Feminist Aesthetics in the Visual Arts,1990
ALDFIT,Virgil C. Aldrich,Form in the Visual Arts,1971
JOHTBA-2,Galen A. Johnson,The Beautiful and the Sublime in Merleau-Ponty and Lyotard,2008
WINTCC-3,Edward Winthers,The Critical Condition of Visual Arts,1996
GILEMA-3,Paul Giladi,Embodied Meaning and Art as Sense-Making: A Critique of Beiser?s Interpretation of the ?End of Art Thesis',2016
MAYF,Patrick Maynard,Form,1996
Hombach2009-SACMVK,Klaus Sachs{-}Hombach and Joerg R. J. Schirra,"Medientheorie, Visuelle Kultur Und Bildanthropologie",2009
ALLATA,Derek Allan,"Art, Time and Metamorphosis",2007
WIGTRO,Frederick S. Wight,The Revulsions of Goya: Subconscious Communications in the Etchings,1946
MULAO,N. Mulholland,"Art \& Outrage: Provocation, Controversy and the Visual Arts: John Albert Walker; Wreckers of Civilisation: The Story of Coum Transmissions and Throbbing Gristle: Simon Ford",2000
MAGUAT-3,Christy Mag Uidhir,Unlimited Additions to Limited Editions,2009
RIOPES-2,Manuel Maximilian Riolo,"Play Ergo Sum. Un'analisi Del Videogioco Tra Finzione, Identit\`a e Trasporto",2016
ALLPL-3,Emmanuel Alloa,Penser L'Image,2010
KULAE,John Kulvicki,Artifact Expression,2008
RATTVA,Floyd Ratliff,The Visual Arts and Sciences: A Symposium Held at the American Philosophical Society,1985
HANTSO-6,Mark Hannam,The Sight of Death,manuscript
ALLAAA-3,Derek Allan,Art: A Rival World - an Aspect of Andr\'e Malraux's Theory of Art,2010
SOWATO,Robert Sowers,A Theory of Primary Modalities in the Visual Arts,1984
WITMFL-2,Ryan Wittingslow,Machines for Living: Philosophy of Technology and the Photographic Image,2014
Derlatka2022-PALPV-3,Kamila Grabowska{-}Derlatka and Jakub Gomu\l{}ka and Rachel 'Preppikoma' Palm,Philosophypulp: Vol. 2,2022
BOSFAM,William H. Bossart,Form and Meaning in the Visual Arts,1966
ALLDS,Emmanuel Alloa and Adnen Jdey,Du Sensible \`A L?Oeuvre : Esth\'{e}tiques de Merleau-Ponty,2012
PODTPO-2,Michael Podro,The Parallel of Linguistic and Visual Formulation in the Writing of Konrad Fiedler,1961
GOLCWA,Catherine Golden,Composition: Writing and the Visual Arts,1986
SMIROT-7,Mark Smith,Reflections on the Hockney-Falco Thesis: Optical Theory and Artistic Practice in the Fifteenth and Sixteenth Centuries,2005
CAPITB-2,Tanner Capps,"In the Beginning is the Icon: A Liberative Theology of Images, Visual Arts, and Culture by Bergmann, Sigurd",2012
FINSAK,"Joerg Fingerhut and Sabine Flach and Jan S\""{o}ffner",Synaesthesia and Kinaesthetics,2011
EAMTIA,Evanghelos A. Moutsopoulos and Jeanne Ferguson,Truth in Art,1985
ALLRIA,Derek Allan,?Reckless Inaccuracies Abounding?: Andr\'e Malraux and the Birth of a Myth,2009
HARTLA-11,Beryl Hartley,The Living Academies of Nature: Scientific Experiment in Learning and Communicating the New Skills of Early Nineteenth-Century Landscape Painting,1996
KEEDCM,Gavin Keeney,Dossier Chris Marker: The Suffering Image,2012
CICYMN,Krzysztof Cicho\'n,"Ypostesij, Metron, Nohema. Three Approaches to Representing Time in Visual Arts",2001
HORWSI-3,Gizela Horvath,"Wessen Schuhe? Identit\""{a}t der Kunstwerke",2011
ALPTPO-2,Philip Alperson,The Philosophy of the Visual Arts,1992
LOTROS-2,Christian Lotz,Representation or Sensation?,2009
RICTVA-2,John Adkins Richardson,The Visual Arts and Cultural Literacy,1990
STEOOA-3,Jakub Stejskal,Objects of Authority: A Postformalist Aesthetics,2022
JANCRS,Christian Janecke,Committed Receptacles. Schlingensief's Usage of the Container in Respect to its Implementation in the Visual Arts,2002
CAPVTF,Tanner Capps,"Visual Theology: Forming and Transforming the Community Through the Arts Edited by Jensen, Robin M. And Kimberly J. Vrudny",2011
WILUVA,Ann Thomas Wilkins,Using Visual Arts in Teaching Mythology,2005
NEICIT,Jenifer Neils,Children in the Visual Arts of Imperial Rome (Review),2007
FLOTSF,Dan Flory,The Society for the Philosophic Study of the Contemporary Visual Arts at the Twentieth World Congress of Philosophy,1999
HORLCD,Gizela Horvath,Les Chaussures de Qui ? L'identit\'e des Oeuvres D'Art,2011
SCHHPA-3,"J\""{o}rg R. J. Schirra and Klaus Sachs{-}Hombach",Homo Pictor and the Linguistic Turn: Revisiting Hans Jonas' Picture Anthropology,2010
ALLRWD,Emmanuel Alloa,"Restitutionen. Wiedergaben des 'Ursprungs des Kunstwerks' in der Franz\""{o}sischen Philosophie",2011
TODIAI,Jennifer Todd,Insight and Ideology in the Visual Arts,1981
RAVRP,Matteo Ravasio,Replicating Paintings,2018
HAYBAT,Deborah J. Haynes,Bakhtin and the Visual Arts,1995
ALLAME-3,Derek Allan,Andr\'e Malraux Et L?Art : Une R\'{e}volution Intellectuelle,2021
PAUAAA-3,Paul Mattick,Aesthetics and Anti-Aesthetics in the Visual Arts,1993
ZAAHTU,Jakob Zaaiman,"How to Understand Modern Contemporary Art, Enjoy It, and Not Be Fooled",2016
ZAAFAT,Jakob Zaaiman,"For ?Art? to Be ?Art?, It has to Be Strange and Disturbing",2015
RIEHGO,Alois Riegl,Historical Grammar of the Visual Arts,2021
ZAAIMS,Jakob Zaaiman,In Monstrous Shallows: Pinpointing Where the Real Art of Jeff Koons Lies,2016
FETQRG,P. Winston Fettner,"""Where Ruin Greenly Dwells:"" Sublimity and Romanticism in Kant's ""Critique of Judgement""",manuscript
SFESAT-2,Nicolae Sfetcu,Solaris (Andrei Tarkovsky): Umanitatea Dezumanizat\ua,2018
HORTTA-5,Gizela Horvath,"T\""{u}kr\""{o}m, T\""{u}kr\""{o}m... Az \""{O}narck\'{e}p Lehet\H{o}s\'{e}gei a Kort\'{a}rs K\'{e}pz\H{o}m\H{u}v\'{e}szetben",2012
DAVCOC-4,Byron Davies,Cavell on Color,2021
CHALCD-11,Madjid Chachour and Zine Mohammed Chaouki,Les Conditions de L'ecriture Sur L'habiter. Le Defi de Deux Discours Savants : L'architecture Et la Philosophie,2019
ALLRWD-3,Emmanuel Alloa,"Restitutionen. Wiedergaben des 'Ursprungs des Kunstwerks' in der Franz\""{o}sischen Philosophie",2011
EFLAHO,Arthur D. Efland,A History of Art Education: Intellectual and Social Currents in Teaching the Visual Arts,1991
ARISOI,Emanuele Arielli,Strategies of Irreproducibility,2019
ZAAHTP,Jakob Zaaiman,Hbo's 'the Price of Everything' (2018): A Documentary by Nathaniel Kahn,2019
COSOFD-2,Rachel Cec\'{i}lia de Oliveira,O Fim da Arte Como Um Come\c{c}o,2014
HORKSD,Gizela Horvath,Kant \'{E}s Duchamp Mint Forr\'{a}s,2019
ZAAANC,Jakob Zaaiman,A New Conception of 'Art',2018
SOR-5,Boris Sorokin,\CYRB\cyrii\cyrl\cyri\cyrishrt \CYRK\cyru\cyrb: \CYRF\cyro\cyrr\cyrm\cyru\cyrv\cyra\cyrn\cyrn\cyrya \CYRG\cyra\cyrl\cyre\cyrr\cyre\cyrishrt\cyrn\cyro\cyrg\cyro \CYRP\cyrr\cyro\cyrs\cyrt\cyro\cyrr\cyru,2018
WLUTSA,Monika Wludzik,Technological Stripping and Meaning Production in 'Duchamp?s the Large Glass',2014
GIZARI,Horv\'{a}th Gizella,"A Rel\'{a}ci\'{o}eszt\'{e}tika Ideiglenes K\""{o}z\""{o}ss\'{e}gei",2016
OKS-4,Samara Oksana,\CYRA\cyrn\cyra\cyrl\cyrii\cyrz \CYRK\cyro\cyrm\cyrp\cyro\cyrz\cyri\cyrc\cyrii\cyryi ?\CYRS\cyrv\cyrii\cyrt\cyro\cyrv\cyre \CYRD\cyre\cyrr\cyre\cyrv\cyro? \CYRN\cyra \CYRR\cyru\cyrsh\cyrn\cyri\cyrk\cyru: \CYRYA\cyrk \CYRS\cyrt\cyra\cyrt\cyri\cyrs\cyrt\cyri\cyrch\cyrn\cyro \CYRV\cyri\cyrz\cyrn\cyra\cyrch\cyri\cyrt\cyri \CYRZ\cyrm\cyrii\cyrs\cyrt \CYRZ\cyro\cyrb\cyrr\cyra\cyrzh\cyre\cyrn\cyrn\cyrya.,2017
HORMTG-2,Gizela Horvath,Mine the Gap. Fine Arts in the Age of Pandemic,2020
HORFON,Gizela Horvath,Faces of Nostalgia. Restorative and Reflective Nostalgia in the Fine Arts,2018
NITIIA,Bogdan Nita,Intentional Image and Transcendental Image in the Work of Art,2012
WEIPAG-2,Peg Brand Weiser,Pittura: A Gendered Template for Painting (1st edition),2022
WEIPAG-3,Peg Brand Weiser,Pittura: A Gendered Template for Painting (1st edition),2022
BRERDP,David Brett,Rethinking Decoration: Pleasure and Ideology in the Visual Arts,2005
PRASOC,James Richard Pratt,Standards of Criticism in the Visual Arts,1961
BAYTBT,Burcu Baykan,"To Be-Between, to Pass Between: Becoming ?Intermezzo? in Orlan?s Carnal Art",2015
VIGJWI,Allen Alain Viguier,Just What is It That Makes the Same so Different? The Object After Post-Object Art.,2015
LLOAAA,Jan Lloyd Jones and Julian Lamb,Art and Authenticity,2010
REILAA-5,Robert Reiff,Lyricism as Applied to the Visual Arts,1974
HORAAM-3,Gizela Horvath,Az Auton\'{o}m M\H{u}v\'{e}szet Alkonya,2017
SMACCD,Howard J. Smagula,Currents: Contemporary Directions in the Visual Arts,1989
LLOAAT,Jan Lloyd Jones,Art and Time,2007
DILATO,John Dillenberger,A Theology of Artistic Sensibilities: The Visual Arts and the Church,1988
HORAMS-2,Gizela Horvath,"A M\H{u}v\'{e}sz \'{E}s a K\""{o}z\""{o}ns\'{e}g Test\'{e}nek Tal\'{a}lkoz\'{a}sa a M\H{u}v\'{e}szet Boncasztal\'{a}n",2018
MURTTO-12,Declan Christopher Murphy,"The Theory of the Visual Arts in Old Russia: Princeton University, 1985",1989
HORKT,Gizela Horvath,"K\'{e}pkeretes T\""{o}rt\'{e}netek",2017
SCHAVR,"J\""{o}rg R. J. Schirra and Martin Scholz",Abstraction Versus Realism: Not the Real Question,1998
STRBC,Thomas Strothotte,{[}Book Chapter],1998
HORASS-4,Gizela Horvath,A Sz\'{e}p \'{E}s a Semmi,2016
KEPTVA,Gyorgy Kepes,The Visual Arts Today,1960
LINAEE-3,Sulamina Fonseca Lino,A Experi\^{e}ncia Est\'{e}tica Do Feio Nas Artes Pict\'{o}ricas,2020
SAULWS,Martina Sauer,"Lambert Wiesing, Sehen Lassen. Die Praxis des Zeigens, Berlin 2013",2014
VANLFY,Carlos Vanegas,La Fotograf\'{i}a y Los Desplazamientos En El Arte Contempor\'{a}neo Colombiano,2013
SAUEAH,Martina Sauer,"Emmanuel Alloa (Ed.): Erscheinung Und Ereignis. Zur Zeitlichkeit des Bildes, M\""{u}nchen 2013",2015
SMUFTM,Aaron Smuts,Film Theory Meets Video Games: An Analysis of the Issues and Methodologies in 'Screenplay',2003
SIMAWT-3,Vid Simoniti,"?Andy Warhol?, Tate Modern, London, 12 March ? 15 November 2020; Then Museum Ludwig, Cologne, 12 December 2020 ? 18 April 2021",2021
JACHLK,Danielle Jacquart,"Herbert L. Kessler; Richard G. Newhauser (Editors). Optics, Ethics, and Art in the Thirteenth and Fourteenth Centuries: Looking Into Peter of Limoge?s ?Moral Treatise on the Eye.? with the Assistance of Arthur J. Russell. Xiv + 212 Pp., Figs., Notes, Bibl., Illus., Index. Toronto: Pims, 2018. \$95 (Cloth); Isbn 9780888442093",2021
HUMPAT,Paul Humble,"""Philosophy and the Visual Arts: Seeing and Abstracting"": Edited by Andrew Harrison",1989
TOPSSF,David Topper,"Six Stories From the End of Representation: Images in Painting, Photography, Astronomy, Microscopy, Particle Physics, and Quantum Mechanics, 1980?2000",2008
KELBRM,Evelyn Fox Keller,Book Review:The Molecular Gaze:Art in the Genetic Age,2004
JONCAP-3,Lisa Jones,"Charles Altieri, Postmodernisms Now",1999
MEETPO-3,Philip Meeson,"""The Power of the Center: A Study of Composition in the Visual Arts"": Rudolf Arnheim",1983
RICLR-3,Angelo Ricci and Guilhermino Cesar,"160 Libri Ricevuti Goran Hermeren, Representation and Meaning in the Visual Arts, Lund, Scan-Dinavian University Books, 1969, Pp. 190",1970
KENTGA,Brian Kennedy,"""Th\'{e}ophile Gautier: A Romantic Critic of the Visual Arts"": Robert Snell",1983
ROGBAT-3,L. R. Rogers,"""Bernini and the Unity of the Visual Arts"": Irving Lavin",1982
BOYBML,Michael Boylan and Denise Inge and Frederic Jameson and Scott Barry Kaufman and James C. Kaufman and Dominic Mciver Lopes and Jean{-}Francois Lyotard and Adrian Pabst and Angus Paddison and Fiona Price,"Benton, Michael. Literary Biography an Introduction.(London: Wiley-Blackwell). 2009. Pp. 280.\pounds 60.00 (Hbk). Bergmann, Sigurd. In the Beginning is the Icon: A Liberative Theology of Images, Visual Arts and Culture.(London: Equinox Publishing Limited). 2009. Pp. 256.\pounds 50.00 (Hbk)",2010
WEIEAT-4,Rudolph H. Weingartner,Ethics and the Visual Arts,2007
MARDM-7,Sauer Martina,Dr. M.A.,1914
