ID,Author,Title,Year
HAVPTP,Eric Alfred Havelock,Preface to Plato,1963
BHAPET,Roy Bhaskar,Plato Etc.: The Problems of Philosophy and Their Resolution,1994
NAITPO-4,Debra Nails,The People of Plato: A Prosopography of Plato and Other Socratics,2002
DOVGPM,Kenneth James Dover,Greek Popular Morality in the Time of Plato and Aristotle,1974
KRATCC-3,Richard Kraut,The Cambridge Companion to Plato,1992
CROAEO,I. M. Crombie,An Examination of Plato's Doctrines,1962
GILPPM,Mary Louise Gill,Philosophos: Plato?s Missing Dialogue,2012
PETSAP-9,Sandra Peterson,Socrates and Philosophy in the Dialogues of Plato,2011
GROPAT-10,George Grote,Plato and the Other Companions of Sokrates,1888
PRIMC-3,A. W. Price,Mental Conflict,1994
BHAPEP,Roy Bhaskar,Plato Etc.: Problems of Philosophy and Their Resolution,2010
SALCOB-2,John Sallis,Chorology: On Beginning in Plato's Timaeus,1999
BEVCSA-2,John Beversluis,Cross-Examining Socrates: A Defense of the Interlocutors in Plato?s Early Dialogues,2000
CAMTST-12,Douglas R. Campbell,The Soul?s Tool: Plato on the Usefulness of the Body,2022
GOLPAT-7,Rebecca Goldstein,Plato at the Googleplex: Why Philosophy Won't Go Away,2014
BRAAWI,Leonard Brandwood,A Word Index to Plato,1976
CHETRO-2,Harold Fredrik Cherniss,The Riddle of the Early Academy,1962
PATPAE,Jan Patoc?ka,Plato and Europe,2002
IRWPH,T. H. Irwin,Plato's Heracleiteanism,1977
GRIPWR-2,Charles L. Griswold,Platonic Writings/Platonic Readings,1988
BRATCO-50,Leonard Brandwood,The Chronology of Plato's Dialogues,1990
BENACT-10,Hugh H. Benson,A Companion to Plato,2006
SCHRAM-15,Lea Aurelia Schroeder,Replenishment and Maintenance of the Human Body,2021
DILTHO,John M. Dillon,"The Heirs of Plato: A Study of the Old Academy, 347-274 B.C",2003
BAIRAO,Nicholas R. Baima,Republic 382a-D: On the Dangers and Benefits of Falsehood,2017
KERP-4,G. B. Kerferd,Plato,1951
ACKEOP,J. L. Ackrill,Essays on Plato and Aristotle,2001
FRIP-2,Paul Friedla?nder,Plato,1969
KRAP,Richard Kraut,Plato,1981
BONNGI,Giulia Bonasio,Natural Goods in the Eudemian Ethics,2021
ANNP-2,Julia Annas,Plato,1986
FINTOH-4,Gail Fine,The Oxford Handbook of Plato,2008
CRIDOA,Matthew Crippen,"Dewey on Arts, Sciences and Greek Philosophy",2016
NEHPAT,Alexander Nehamas,Plato and the Mass Media,1988
ALLWPW-5,Danielle S. Allen,Why Plato Wrote,2010
OSBDBA,Catherine Osborne,Dumb Beasts and Dead Philosophers: Humanity and the Humane in Ancient Philosophy and Literature,2007
FOWHAH,Robert L. Fowler,Herodotos and His Contemporaries,1996
LONCAS,Alex Long,Conversation and Self-Sufficiency in Plato,2013
ANNPAV,Julia Annas,Plato: A Very Short Introduction,2003
KAHSPU,Charles H. Kahn,"Some Philosophical Uses of ""to Be"" in Plato",1981
GORPEW-3,Jill Gordon,Plato's Erotic World: From Cosmic Origins to Human Death,2012
BOAFAL,George Boas,Fact and Legend in the Biography of Plato,1948
PERPNE-2,Marcelo Perine,Plat\~{a}o N\~{a}o Estava Doente,2014
FRIP-13,Paul Friedla?nder,Platon,1928
GRUPT-2,George Maximilian Anthony Grube,Plato's Thought,1935
LEVIDO-2,Ronald Bartlett Levinson,In Defense of Plato,1953
HANPIT-2,James Hankins,Plato in the Italian Renaissance,1990
COHRIA,S. Marc Cohen and Patricia Curd and C. D. C. Reeve,Readings in Ancient Greek Philosophy: From Thales to Aristotle,2016
KIRPAR,Christopher Kirwan,Plato and Relativity,1974
PENS,Terry Penner,Socrates,2000
DEHSSI,Vanessa de Harven,Something Stoic in the Sophist,forthcoming
MASP-5,Andrew S. Mason,Plato: Pamphlet Vol,2010
LVYFDS,David L\'{e}vystone,Figures du Sommeil Et du R\^{e}ve Chez Platon,2019
JOOAII,Albert Joosse,Anchoring Innovation in the Platonic Axiochus,2022
ADETPO-8,Francesco Ademollo,The Platonic Origins of Stoic Theology,2012
MALPA,John Malcolm,Plato's Analysis,1967
BURTMA-2,M. F. Burnyeat,The Material and Sources of Plato's Dream,1970
CHEPT,Harold Cherniss and G. M. A. Grube,Plato's Thought,1936
CUSTPC,Robert Earl Cushman,Therapeia: Plato's Conception of Philosophy,1958
SWIPTA,Alice Swift Riginos,Platonica: The Anecdotes Concerning the Life and Writings of Plato,1976
BAMNEO-3,Renford Bambrough,New Essays on Plato and Aristotle,1965
PAPPAP-2,Nickolas Pappas and Mark Zelcer,"Politics and Philosophy in Plato's Menexenus: Education and Rhetoric, Myth and History",2014
WILPTI,Bernard Williams,Plato: The Invention of Philosophy,1998
ZHMPAA,Leonid Zhmud,"Plato as ""Architect of Science""",1998
JACSOT-4,Dale Jacquette,Socrates on the Moral Mischief of Misology,2014
LAVUVC,Salvatore Lavecchia,Una Via Che Conduce Al Divino: La Homoiosis Theo Nella Filosofia di Platone,2006
KRESIW,Norman Kretzmann,Socrates is Whiter Than Plato Begins to Be White,1977
FORTBO-10,Simona Forti,The Biopolitics of Souls,2006
BNATPA,"Thomas B\'{e}natou\""{i}l and Mauro Bonazzi","Theoria, Praxis, and the Contemplative Life After Plato and Aristotle",2012
FIEPAH-2,G. C. Field,Plato and His Contemporaries,1930
GEIPET,Alfred Geier,Plato's Erotic Thought: The Tree of the Unknown,2002
FINP-2,Gail Fine,Plato,2000
KLOCOF,G. Klosko,Criteria of Fallacy and Sophistry for Use in the Analysis of Platonic Dialogues,1983
FINI-3,Gail Fine,Introduction,1999
TAYPAT-2,C. C. W. Taylor,Plato and the Mathematicians: An Examination of Professor Hare's Views,1967
CATPAA,Thomas Cathcart,Plato and a Platypus Walk Into a Bar--: Understanding Philosophy Through Jokes,2006
BARCLP,Pedro Baratieri,Como Ler Plat\~{a}o? Para Uma Leitura N\~{a}o-Apolog\'{e}tica Dos Di\'{a}logos,2024
HARPOW-3,Chelsea Harry and Polansky Ron,Plato on Women?s Natural Ability: Revisiting Republic V and Timaeus 41e3?44D2 and 86B1?92C3,2016
SHOWPS-5,Paul Shorey,What Plato Said,1933
BAITST,Jacques Bailly,"The Socratic Theages: Introduction, English Translation, Greek Text and Commentary",2004
GRA_AP-4,Daniel Graham,Socrates and Plato,1992
DAVPP-3,Donald Davidson,Plato's Philosopher,1993
ADETPO-2,Francesco Ademollo,The Platonic Origins of Stoic Theology,2012
FAGPAT,Patricia Fagan,Plato and Tradition: The Poetic and Cultural Context of Philosophy,2013
SANIDO-3,Constantine Sandis,In Defence of Four Socratic Doctrines,2008
HERWI-2,Fritz{-}Gregor Herrmann,Words \& Ideas: The Roots of Plato's Philosophy,2007
FOLTOQ,Richard Foley,The Order Question,2010
HOBFII,Angela Hobbs,Female Imagery in Plato,2006
DILTHO-5,Lloyd P. Gerson,The Heirs of Plato: A Study of the Old Academy,2004
SEBFWP,Dagmar Kiesel and Sebastian Schmidt,"Freier Wille, Personale Identit\""{a}t Und Epistemische Ungewissheit",2019
HYLAIP,Drew A. Hyland,And in Plato,1968
DORTDL,Kenneth Dorter,Three Disappearing Ladders in Plato,1996
BLATAO-3,David L. Blank,The Arousal of Emotion in Plato's Dialogues,1993
KENPSA-2,Rosamond Kent Sprague,Parmenides' Sail and Dionysodorus' Ox,1967
NEUDCO-3,Harry Neumann,Diotima's Concept of Love,1965
MILUTI-2,Mitchell Miller,"""Unwritten Teachings"" in the ""Parmenides""",1995
MARPOH-2,Marjorie O'Rourke Boyle,Pure of Heart: From Ancient Rites to Renaissance Plato,2002
HOETPC,R. G. Hoerber,Thrasylus' Platonic Canon and the Double Titles,1957
PRETCC-3,Gerald A. Press,The Continuum Companion to Plato,2012
ASTLPS-2,Friedrich Ast,Lexicon Platonicum: Sive Vocum Platonicarum Index,2012
KONPHN,Hugo Koning,Plato's Hesiod: Not Plato's Alone,2009
PARSRA-2,John Partridge,"Socrates, Rationality, and the Daimonion",2008
LESSNA,J. H. Lesher,Some Notable Afterimages of Plato's Symposium,2006
DRIAAP,Ingemar Du?ring,Aristotle and Plato in the Mid-Fourth Century,1960
RANPDO,John Herman Randall,Plato: Dramatist of the Life of Reason,1970
WOOTSO-2,Frederick James Eugene Woodbridge,The Son of Apollo: Themes of Plato,1929
FRETPO-4,Bernard Freydberg,The Play of the Platonic Dialogues,1997
BRUPMI,Robert Sherrick Brumbaugh,Plato's Mathematical Imagination,1954
LANPPH,M. S. Lane,Plato's Progeny: How Socrates and Plato Still Captivate the Modern Mind,2001
DEVRPA,Cornelia J. De Vogel,Rethinking Plato and Platonism,1986
KOYDP,Alexandre Koyre?,Discovering Plato,1945
MELUP,David J. Melling,Understanding Plato,1987
SHOPAA-2,Paul Shorey,"Platonism, Ancient and Modern",1938
PATPAP,Walter Pater,Plato and Platonism,1894
SOLLRD,Marco Solinas,La Riscoperta Della Via Regia. Freud Lettore di Platone,2012
DEHPPA,Vanessa de Harven and Wolfgang{-}Rainer Mann,"Pleasure, Pain, and the Unity of Soul in Plato's Protagoras",2018
MILFRF-3,Mitchell Miller,"Figure, Ratio, Form: Plato's Five Mathematical Studies",1999
ILITAM,Viktor Ilievski,Theodicy and Moral Responsibility in the Myth of Er,2018
BADPOD,Alain Badiou and Alberto Toscano,"Plato, Our Dear Plato!",2006
AUSOAC,Hayden W. Ausland,On a Curious Platonic Dialogue,2005
BRISAT-6,Luc Brisson,Socrates and the Divine Signal According to Plato's Testimony: Philosophical Practice as Rooted in Religious Tradition,2005
GEREPH,Lloyd P. Gerson,Epistrophe Pros Heauton: History and Meaning,1997
Gordon2011-HARPPO-2,Sophie Haroutunian{-}Gordon,Plato's Philosophy of Listening,2011
GIAIAO-2,Zina Giannopoulou,In and Out of Worlds,2011
LOFABO,J. Robert Loftis and Andrew P. Mills,Annotated Bibliography of Resources for Teaching Plato,2016
LVYLMD-4,David L\'{e}vystone,"Les Mules du Parth\'{e}non Et la Libert\'e En D\'{e}mocratie. Note Sur la R\'{e}publique de Platon Viii, 563C7-D1",2020
LVYDQF,David L\'{e}vystone,De Quelques Figures du Silence Dans L?\O{E}uvre de Platon,2018
WATAHO-4,Sarah Waterlow,A History of Greek Philosophy. Vol. 5: The Later Plato and the Academy,1979
BIARFT-2,Emanuela Bianchi,Receptacle/ Ch\={o}ra: Figuring the Errant Feminine in Plato's Timaeus,2001
DESIIE,M. {-}L. Desclos,"Idoles, Ic\^{o}nes Et Phantasmes Dans les Dialogues de Platon",2000
PLUPFE,Val Plumwood,Prospecting for Ecological Gold Amongst the Platonic Forms: A Response to Timothy Mahoney,1997
JACTPO-13,B. Darrell Jackson,The Prayers of Socrates,1971
DEVPPI-3,Daniel T. Devereux,Pauline Predications in Plato,1977
RENTDO,Renford Bambrough,"The Disunity of Plato's Thought, Or: What Plato Did Not Say",1972
GRAATO-4,Daniel W. Graham,A Testimony of Anaximenes in Plato,2003
PRIPR,William J. Prior,Plato,1979
ANDOLC,Joshua Anderson,"Ordinary Language, Cephalus and a Deflationary Account of the Forms",2020
LARPPE,Olof Pettersson and Vigdis Songe{-}M\o{}ller,Plato?s Protagoras: Essays on the Confrontation of Philosophy and Sophistry,2016
CUFSME,Domenico Cufalo,Scol\^i Medievali e Tradizione Antica,2011
GHOAOC-2,Mohammad Bagher Ghomi,An Onto-Epistemological Chronology of Plato?s Dialogues,manuscript
GKAAAX,Konstantinos Gkaleas,Aristippus and Xenophon as Plato?s Contemporary Literary Rivals and the Role of Gymnastik\`e (\ensuremath{\Gamma}\ensuremath{\upsilon}\ensuremath{\mu}\ensuremath{\nu}\ensuremath{\alpha}\ensuremath{\sigma}\ensuremath{\tau}\ensuremath{\iota}\ensuremath{\kappa}?),2015
BONADE,Kieran Bonner,"A Dialogical Exploration of the Grey Zone of Health and Illness: Medical Science, Anthropology, and Plato on Alcohol Consumption",2009
HENWPK-2,Michele C. Henderson and M. Gregory Oakes and Marilyn Smith,What Plato Knew About Enron,2009
MCGPMI,Elizabeth McGrath,Platonic Myth in Renaissance Iconography,2009
BACLCC-2,Franco Bacchelli,La Consid\'{e}ration C\'{e}leste Et les Enseignements de D\'{e}m\'{e}trius Rhaoul Kav\`{a}kis,2016
FELPAS,Simone Fellina,Platone a Scuola: L?Insegnamento di Francesco de? Vieri Detto Il Verino Secondo,2015
ROSROV,Gabriela Rossi,?Ret\'{o}rica o Verdad? La ?Tercera V\'{i}a? de Plat\'{o}n,2003
CUFNST,Domenico Cufalo,Note Sulla Tradizione Degli Scoli Platonici,2001
SOLLPD-2,Marco Solinas,La Paternit\`a Dell?Eros: Il ?Simposio? e Freud,2005
ANDPAN-8,Mark Anderson,Platonic and Nietzschean Themes of Transformation in Moby-Dick,2017
ANDNSR,Mark Anderson,Nietzsche's Subversive Rewritings of Phaedo-Platonism,2016
BOBPOU,Chris Bobonich,Plato on Utopia,2008
PALSST-3,Kent Palmer,Special Systems Theory,manuscript
SOLSLV,Marco Solinas,La Via Platonica Alla Interpretazione Dei Sogni,2017
Castrillejo2016-TORLDC-3,David Torrijos{-}Castrillejo,La Dimensione Comunitaria Della Formazione Filosofica Secondo Aristotele,2016
LEDRPA,Gerard R. Ledger,Re-Counting Plato: A Computer Analysis of Plato's Style,1989
DRIPAD,"Klaus D\""{o}ring and Michael Erler and Stefan Schorn",Pseudoplatonica: Akten des Kongresses Zu den Pseudoplatonica Vom 6.-9. Juli 2003 in Bamberg,2005
AND-21,Mark Anderson,?\ensuremath{\lambda}\ensuremath{\eta}\ensuremath{\theta}? \ensuremath{\Lambda}?\ensuremath{\gamma}\ensuremath{\epsilon}\ensuremath{\iota}\ensuremath{\varsigma}: Speaking the Truth in Plato?s Republic,2010
LEVPOW,Susan B. Levin,Plato on Women?s Nature,2000
EDMWWS,Lowell Edmunds,What Was Socrates Called?,2006
EVAAP,David Evans,Argumenty Plato\'{n}skie,1998
GORP-4,"Herwig G\""{o}rgemanns",Platon,1994
BARMEI-2,Jonathan Barnes,Mantissa: Essays in Ancient Philosophy Iv,2014
FIEPAH-9,Guy Cromwell Field,Plato and His Contemporaries; a Study in Fourth-Century Life and Thought,1967
MCCTMO-2,John McCrone,The Myth of Irrationality: The Science of the Mind From Plato to Star Trek,1994
CROPT,R. H. S. Crossman,Plato to-Day,1959
DOMWPA-3,Daniel A. Dombrowski,Was Plato a Vegetarian?,1984
FERISP-2,Rafael Ferber,"Ii Symposium Platonicum. Gr\""{u}dung der Internationalen Platon-Gesellschaft",1991
BUFPOT-2,Thomas O. Buford,Plato on the Educational Consultant,1977
CORPAO,F. M. Cornford,Plato and Orpheus,1903
GRAWSK,Daniel W. Graham,What Socrates Knew,1997
BAMP,Renford Bambrough,Plato,1960
SCHPOT-5,M. Schofield,Plato on the Economy,1993
BLUWWC,Natalie Harris Bluestone,Why Women Cannot Rule: Sexism in Plato Scholarship,1988
ARTPAA,S. Arthur Madigan,"Plato, Aristotle and Professor Macintyre",1983
FINCA,Gail Fine,Conflicting Appearances: Theaetetus 153D-154B,1996
CLASMA-3,Diskin Clay,Socrates' Mulishness and Heroism,1972
RENPMF,Renford Bambrough,Plato's Modern Friends and Enemies,1962
ADASEA,Don Adams,"Sophia, Eutuchia and Eudaimonia in the Euthydemus",2014
BENSMO-2,Seth Benardete,Some Misquotations of Homer in Plato,1963
ALLP-2,D. J. Allan,Plato,1951
PATPOP,Richard Patterson,Plato on Philosophic Character,1987
BURPI-6,John Burnet,Platonica Ii,1905
DESTHO,Rosemary Desjardins,The Horns of Dilemma,1981
GOOMDA-2,C. F. Goodey,Mental Disabilities and Human Values in Plato?s Late Dialogues,1992
JACPOF-4,William Jacobs,Plato on Female Emancipation and the Traditional Family,1978
LODPAP-2,Rupert C. Lodge,Plato and Progress,1946
GOLPIT,Jeffrey Gold,Plato in the Light of Yoga,1996
MOOASR,Jared S. Moore,A Suggestion Regarding Plato and Socrates,1935
ALAGFH,Maya Alapin,"Glaucon?s Fate: History, Myth, and Character in Plato?s Republic, by Jacob Howland",2020
BARTPC-5,Stephen Barnes,Teaching Plato?s Cave,2002
RALSIA,Mark Ralkowski,Socratic Ignorance and Platonic Knowledge in the Dialogues of Plato. By Sara Ahbel-Rappe,2021
PROSTO,Pedro Proscurcin Junior,Some Thoughts on the Socratic Use of Iliad X 224 in Plato's Protagoras and Symposium : A Dialogical Context Previous to the Dialectic Method?,2018
LOUTBO-7,Adam Loughnane,"The Birth of Fire, Indescribable Light, and the Limits of Philosophy?s Violence: N\={a}g\={a}rjuna and Plato Seeing and Speaking of Nothing",2020
CHRTIO-7,Anton{-}Hermann Chroust,"The Influence of Zoroastrian Teachings on Plato, Aristotle, and Greek Philosophy in General",1980
PEEFPA-2,Chris Peers,"Freud, Plato and Irigaray: A Morpho-Logic of Teaching and Learning",2012
CLATAT-14,Stephen R. L. Clark,Therapy and Theory Reconstructed: Plato and His Successors,2010
NERMJK,Zbigniew Nerczuk,Miar\ka Jest Ka\.{z}dy Z Nas: Projekt Zwolennik\'{o}w Zmienno\'{s}ci Rzeczy W Plato\'{n}skim Teajtecie Na Tle My\'{s}li Sofistycznej (Each of Us is a Measure. The Project of Advocates of Change in Plato?s Theaetetus as Compared with Sophistic Thought),2009
DEBPDE,Debra Nails,Plato's Democratic Entanglements: Athenian Politics and the Practice of Philosophy (Review),2001
NERLDC-2,Zbigniew Nerczuk,La Dimension Comica Del Discurso de Socrates En El ?Gorgias?,2018
CROSP,I. M. Crombie,Socratic Problems,1980
NADPTC,Gerard Naddaf,Plato,2004
LOSPA,Alekse\ui Fedorovich Losev,Platon; Aristotel?,2005
HARP-5,R. M. Hare,Plato,1982
RAWBDM-2,Elizabeth Rawson,"Bruce D. Macqueen: Plato's Republic in the Monographs of Sallust. Pp. X + 99. Chicago: Bolchazy-Carducci, 1981. Paper",1983
DILPIL,J. Dillon,Plato in Late Antiquity,1995
OTTTLO,K. Darcy Otto,The Logic of the First Horn of the Dilemma of Participation,2009
MAYGOS-3,Robert Mayhew,God or Some Human,2011
CIMPTM,Claude Imbert and Denise L. Davis and Jennifer Curtiss Gage,"Plato, the Mirror of the World and the Book",1997
LAFRPA,Yvon Lafrance,"Rethinking Plato and Platonism C. J. De Vogel Mnemosyne, Supp. 92 Leiden: E. J. Brill, 1986. X, 253 P. F85",1987
BONTOO-2,Mauro Bonazzi and Jan Opsomer,The Origins of the Platonic System: Platonisms of the Early Empire and Their Philosophical Contexts,2009
GRUXUP,G. M. A. Grube and Emma Edelstein,Xenophontisches Und Platonisches Bild des Sokrates,1937
PITPTK,Dariusz Pi\k{e}tka,Platon Tw\'{o}rc\ka Klasycznej Koncepcji Prawdy,2009
MOUKZT,Evangelos Moutsopoulos,"Kretanje Zvukova, Tijela I Du\v{s}a [Platon, Zakoni Vii. 790E I D.]",2002
LNBSAX,"Sven L\""{o}nborg",Socrates and Xanthippe,1949
JONDP,Carol Jones,Doing Plato,2002
BARP-10,Peter Jean Bart,Plato,1927
OAKTRE-3,Hilda D. Oakeley,The Religious Element in Plato's Philosophy,1926
MARDMP-2,Gottfried Martin,Das Metaphysische Problem der Ideenlehre Platons,1961
ALLJVC,D. J. Allan,"Jean van Camp Et Paul Canart: Le Sens du Mot \ensuremath{\Theta}\ensuremath{\epsilon}??\ensuremath{\varsigma} Chez Platon. Pp. 452. Louvain: Nauwelaerts, 1956. Paper, 375 B. Fr",1959
CHAPLP,William Charlton,Plato's Later Platonism,1995
KRAPAS,Richard Kraut,Plato and Socrates,2010
GRIEPU-5,Charles L. Griswold,E Pluribus Unum? On the Platonic ?Corpus?,2000
PEPTQF-2,Adriaan Theodoor Peperzak,The Quest for Meaning: Friends of Wisdom From Plato to Levinas,2003
MILQPC,Mitchell H. Miller,Questioning Platonism: Continental Interpretations of Plato (Review),2005
FIESAP,G. C. Field,Socrates and Plato,1914
SINPAT,Niketas Siniossoglou,Plato and Theodoret: The Christian Appropriation of Platonic Philosophy and the Hellenic Intellectual Resistance,2008
IRVWWP-2,A. D. Irvine,What Was Plato's Real Name?,1994
GAUPCO,Hermann Gauss,Plato's Conception of Philosophy,1937
MAAPMG-2,Helmut Maassen,Plato?s Mythical God,1994
CARPAM-2,Robert Edgar Carter,Plato and Mysticism,1975
HEGTPO-8,G. W. F. Hegel,The Philosophy of Plato,1870
RISPL,John M. Rist and Thomas Gould,Platonic Love,1965
KLEATP,Norman F. Cantor,Ancient Thought: Plato \& Aristotle,1968
DRATPP,Henry L. Drake,The People's Plato,1958
PATPAP-7,Walter Pater,Plato and Platonism a Series of Lectures,1893
MEYPUD,Martin F. Meyer,Platon Und Das Sokratische Pragma,2004
ANTTPC-3,Audrey L. Anton,Teaching Plato?s Cave Through Your Students? Past Experiences,2016
COR_MC-3,Kevin Corrigan,"\emph{Platonic Mysticism: Contemplative Science, Philosophy, Literature, and Art} \emph{, Written by }Arthur Versluis",2018
HSLAFO,"Vittorio H\""{o}sle",A Form of Self-Transcendence of Philosophical Dialogues in Cicero and Plato and its Significance for Philology,2005
LESP,A. H. Lesser,Plato,2011
PLATGI,Plato,The Great Ideas of Plato,1952
BALORA,Edward G. Ballard,On Ritual and Persuasion in Plato,1964
CUNPAO,Francis J. Cunningham,Plato: Archaic or Modern Man?,1975
AALPFI,A. A. Long,Plato's First Interpreters (Review),2003
BERADO-9,John M. Berry,A Deconstruction of Plato?s ?Battle of Gods and Giants?,1986
DODPPB,P. W. Dodd,"Platonism Platonism. By John Burnet, F.B.A. Pp. 130. Berkeley, California: University of California Press, 1928. 9S",1929
MCKPAS-5,Richard D. McKirahan,Plato and Socrates : A Comprehensive Bibliography 1958-1973,1978
ANDPAN-7,Mark Anderson,Plato and Nietzsche: Their Philosophical Art,2014
BP-5,R. J. B.,Plato,1962
FEHAGT,Noah Edward Fehl,"A Guide to the Study of Plato's Republic, and the Socratic Dialogues",1961
CROPTM,I. M. Crombie,"Plato, the Midwife's Apprentice",1964
BURP-2,John Burnet,Platonism,1928
RANSIT-2,Nalin Ranasinghe,Socrates in the Underworld,2009
GIBTBO,A. Boyce Gibson,Three Books on Plato.Plato and His Contemporariesplato's Theory of Artin Defense of Plato,1954
OOKPIC,Sheryar Ookerjee,Plato's Indian Connection,2010
MASDV-2,Andrew Mason,Diverse Voyages,2017
CHEPAH-2,Harold Cherniss and G. C. Field,Plato and His Contemporaries,1933
HINDLR,Judith Hindermann,Does Lucius Really Fail to Learn From Socrates' Fate?,2010
BOB_OA-2,Bob Sharples,More on 'A\ensuremath{\nu}\ensuremath{\alpha}\ensuremath{\mu}\ensuremath{\nu}\ensuremath{\eta}\ensuremath{\sigma}\ensuremath{\iota}\ensuremath{\varsigma} in the Meno,1999
EHRPGT,Jerry Dell Ehrlich,Plato's Gift to Christianity: The Gentile Preparation for and the Making of the Christian Faith,2001
GRIUP,Charles L. Griswold,Unifying Plato,1990
PHITP,E. D. Phillips,"Tutto Platone G. Giannantoni (Ed.): Platone, Opere. 2 Vols. Pp. Xvii + 1294, 1254. Bari: Laterza, 1967. Cloth",1970
Gillet2010-STEGBA-2,Suzanne Stern{-}Gillet,"G.R. Boys-Stones and J.H. Haubold, Plato and Hesiod, Oxford University Press, 2010",2010
PRIPTA,William J. Prior,Platonica: The Anecdotes Concerning the Life and Writings of Plato,1980
BARGPB,Peter J. Bart,Greek Philosophy Before Plato,1928
DERDAP,Irina Dereti\'c,"Dispute About Plato's ""Unwritten Doctrine""",2003
NORPCO,Robert G. North,Plato's Conception of Philosophy,1938
FEROAS,A. S. Ferguson,On a Supposed Instance of Dualism in Plato,1921
IMCADO,I. M. Crombie,A Dream of Socrates,1989
BAMPCO,Renford Bambrough,Plato's Conception of Philosophy,1960
GALPRM,David Gallop,"Plato R. M. Hare ?Past Masters? Series Oxford, Ny: Oxford University Press, 1982. Pp. Vi, 82. \$22.75 Cloth; \$3.50 Paper",1984
ADAMAA-2,James Adam and D. B. Monro,Mr. Adam and Mr. Monro on the Nuptial Number of Plato,1892
HAVTNO,E. Haverfield,Two Notes on Syracuse,1889
RHAPBP,R. Hackforth,"Plato. By Philip Leon, M.A. (London: T. Nelson \& Sons, Ltd. 1939. Pp. 147. Price 2S. 6D.)",1941
BERPYE,Alberto Bernabe? Pajares,Plato?N y El Orfismo: Dia?Logos Entre Religio?N y Filosofi?A,2011
GORITI-2,Jill Gordon,In the Image of Plato,2007
PASPIT-6,Dan Passell,Plato?s ?Introduction to Philosophy?,2000
MEAP-6,William Meany,Plato,1954
ANNCJR,Julia Annas,"C. J. Rowe: Plato. (Philosophers in Context, 2.) Pp. Viii + 228. Brighton: Harvester, 1984. \pounds22.50",1985
CONOTA-2,Fred C. Conybeare,On the Ancient Armenian Versions of Plato,1889
HOWPAT-3,Jacob Howland,Plato and the Talmud,2010
SCHPUD,Arbogast Schmitt,Platon Und Das Empirische Denken der Neuzeit,2006
LEMTOP,Joseph Lemelin,"The Other Plato: The T\""{u}bingen Interpretation of Plato?s Inner-Academic Teachings",2015
CROTPO-55,R. C. Cross and Rupert C. Lodge,The Philosophy of Plato,1957
FRBPOP,Muhsin Farabi and Mahdi,Philosophy of Plato and Aristotle,1962
HARPB,Richard Mervyn Hare,"Platon, Bucure\c{s}ti",forthcoming
REEPOP,Francis M. Reeves,Problems of Philosophy and Society: A Conversation with Plato,1988
GILTEO-4,Christopher Gill,The Evolution of an Ideal,1980
OWERFT,Joseph Owens,Recent Footnotes to Plato,1967
MCCFFA,Mary Margaret McCabe,"Form, Forms, and Reform: Richard Kraut, the Cambridge Companion to Plato",1994
HOBPOW,Angela Hobbs,Plato on War,2007
BORPAA-2,E. K. Borthwick,Plato and Aristotle on Musical Theory,1963
EVAAPP,John David Gemmill Evans,A Plato Primer,2010
PLAGR,According to Plato and the Evils of the Body Cannot,Giovanni Reale,2002
MORSLA-3,Michael Morris,Socrates' Last Argument,1985
CROP,R. C. Cross,Plato,1974
FLOGPA,Robert J. Flower,"G.E.L.Owen, Plato and the Verb ""to Be""",1980
TARDPI-2,Harold Tarrant,"Domenico Pesce: Il Platone di Tubinga, e Duo Studi Sulla Stoicismo. (Antichit\`a Classica e Cristiana, 30.) Pp. 107. Brescia: Paideia, 1990. Paper, L. 20,000",1993
RALWPA,Mark Ralkowski,Was Plato a Platonist?,2007
JONTAV,H. Stuart Jones,The 'Ancient Vulgate' of Plato and Vind. F,1902
BARTDI-5,Jos\'e C. Baracat,The Devil in the Details,2016
OBOFIM-2,N. S. Oboturova,Filosofii?a? Idei: Monografii?A?,2009
MARPEL-2,Ahmed Marouani,Platon Et l'Homme Dans les Derniers Dialogues,2010
HESAFR-3,Blake Hestir,A Few Remarks on ?Plato?s Naivete?,1999
ROSTEL-2,Stanley Rosen,The Examined Life: Readings From Western Philosophy From Plato to Kant,2000
PERDGA,Wilhelm Perpeet,Das Gute Als Einheit. Zur Agathon-Spekulation Platons,1966
ASMP-2,Valentin Ferdinandovich Asmus,Platon,1969
FIETPO,Guy Cromwell Field,The Philosophy of Plato,1969
GUTAHO-22,William Keith Chambers Guthrie,"A History of Greek Philosophy: Volume 5, the Later Plato and the Academy",1978
GCFGTI,G. C. Field,Great Thinkers: (Ii) Plato,1934
NIGAMO-2,Andrea Nightingale and David Sedley,Ancient Models of Mind: Studies in Human and Divine Rationality,2010
MACMMK,Robin Maconie,Musicologia: Musical Knowledge From Plato to John Cage,2010
CARSSM,Don Carmichael,"S. Sara Monoson, Plato's Democratic Entanglements: Athenian Politics and the Practice of Philosophy Reviewed By",2001
WATAHO-21,Gerard Watson,A History of Greek Philosophy,1978
RITBOP,Constantin Ritter,"Bibliographies on Plato, 1912-1930",1912
GOTTTO-5,Richard Gotshalk,The Temporality of Human Excellence: A Reading of Five Dialogues of Plato,2001
PATPAP-8,Walter Pater,"Plato and Platonism, a Series of Lectures: By Walter Pater; Fellow of Brasenose College",1893
MEYTCW,Hugo Meynell,"The Crane's Walk: Plato, Pluralism, and the Inconstancy of Truth. By Jeremy Barris",2011
BROHFN-2,Lesley Brown,"Helen F. North : Interpretations of Plato. A Swarthmore Symposium. Pp. Vii + 112. Leiden: Brill, 1977. Paper, Fl. 38",1980
PLATPO-21,Stephen R. Plato and Hill,The Power of Plato,2002
BALPT,H. C. Baldry,Platonic Terminology,1961
CURKBP-2,Thomas Curran,"Kritik \""{U}ber Pestalozzi (1999): Der Fragende Sokrates",2002
LUCSPY,D. W. Lucas,"Sherman Plato Young: The Women of Greek Tragedy. Pp. 174. New York: Exposition Press, 1953. Cloth, \$3.50",1955
VALROP,Vivil Valvik Haraldsen and Olof Pettersson and Oda E. Wiese Tvedt,Readings of Plato's Apology of Socrates: Defending the Philosophical Life,2017
HARTII,Ray L. Hart,The Imagination in Plato,1965
BERHOP,Robert M. Berchman and John F. Finamore,History of Platonism: Plato Redivivus,2005
