ID,Author,Title,Year
RSHMD,Orly R. Shenker,"Maxwell's Demon 2: Entropy, Classical and Quantum Information, Computing",2004
CUFRCG,Michael E. Cuffaro,"Review Of: Christopher G. Timpson, Quantum Information Theory and the Foundations of Quantum Mechanics",2014
BARTSW,Jeffrey A. Barrett,The Strange World of Quantum Mechanics Daniel F. Styer,2001
LORAOQ,Nicol\'{a}s F. Lori and Alex H. Blin,"Application of Quantum Darwinism to Cosmic Inflation: An Example of the Limits Imposed in Aristotelian Logic by Information-Based Approach to G\""{o}del?s Incompleteness",2010
TQSD,P. T.,"Quantum State Diffusion - Ian Percival, Quantum State Diffusion, Cambridge University Press, Cambridge, 1998",2002
BRNQA,Erwin Bruning and Thomas Konrad and Francesco Petruccione,"Quantum Africa 2010: Theoretical and Experimental Foundations of Recent Quantum Technology, Umhlanga, South Africa, 20-23 September 2010",2012
NORROA-2,Travis Norsen,"Review of Alisa Bokulich, Gregg Jaeger (Eds.), \emph{Philosophy of Quantum Information and Entanglement}",2011
BROAES-2,H. Brown,"A. Elitzur, S. Dolev and N. Kolenda, Editors, Quo Vadis Quantum Mechanics?, Springer, Berlin, Heidelberg, New York (2005) Isbn 3-540-22188-3 (61 Figs., 421Pp., \$ 59.95, Hardcover)",2007
FELROQ,Laura Felline,"Review of 'Quantum Information Theory and the Foundations of Quantum Mechanics', by Christopher G. Timpson",2014
Ake2008-JANQMA,Larsson Jan{-}\A{A}ke,"Quantum Mechanics at the Crossroads, James Evans, Alan S. Thorndike. Springer, Berlin (2007). 249Pp., Hardcover, Us\$ 69.95, Isbn: 978-3-540-32663-",2008
CARQTA,Nancy Cartwright,"Quantum Theory and Measurement. John Archibald Wheeler, Wojciech Hubert Zurek",1985
MINUGA,C. Miniatura,"Ultracold Gases and Quantum Information: E?Cole d'E?Te? de Physique des Houches in Singapore, Session Xci, 29 June-24 July 2009, e?Cole the?Matique du Cnrs",2011
MASQSD,V. S. Mashkevich,"Quantum Statistical Dynamics: Statistics Origin, Measurement, and Irreversibility",1985
LIEMRT,Richard Lieu,Microscopic Relativity: The Basic Theory,2001
GUDBRQ-2,Stanley P. Gudder,"Book Review: Quantum Computing and Quantum Communications, Edited by Colin P. Williams",1999
KLABRT,John R. Klauder,"Book Review: Time, Quantum and Information. First Edition, Corrected 2Nd Printing. By Lutz Castell and Otfried Ischebeck, Springer, Berlin, Germany, 2004, Xiii + 456 Pp., \$ 69.95",2005
DANAAO-2,C. D'Antonl and P. Scanzano,An Application of Information Theory: Longitudinal Measurability Bounds in Classical and Quantum Physics,1980
DICCOA-2,Stephanie Dick,Coming of Age with Quantum Information: Notes on a Paulian Idea,2013
